signature,channel_id,channel_name,msg_id,message,cleaned_message,date,msg_link,msg_from_peer,msg_from_id,views,number_replies,number_forwards,is_forward,forward_msg_from_peer_type,forward_msg_from_peer_id,forward_msg_from_peer_name,forward_msg_date,forward_msg_date_string,forward_msg_link,is_reply,reply_to_msg_id,reply_msg_link,contains_media,media_type,has_url,url,domain,url_title,url_description,document_type,document_id,document_video_duration,document_filename,poll_id,poll_question,poll_total_voters,poll_results,contact_phone_number,contact_name,contact_userid,geo_type,lat,lng,venue_id,venue_type,venue_title,venue_address,venue_provider
msg_iteration.16861.user.cozytvarchive.post.11177,1681447027,cozytvarchive,11177,,Tenryo Nick Fuentes On Fresh and Fit! (Part One) Part 1 of 3 07/07/2023 • 9 hour 24 minute stream • 212 peak viewers,2023-07-08 09:04:20+00:00,https://t.me/cozytvarchive/11177,,,228,0,1,0,,,,,,,0,,,1,MessageMediaDocument,0,,,,,video/mp4,4.99234321891066e+18,11300.0,tenryo-2023-07-08-part-0.mp4,,,,,,,,,,,,,,,
msg_iteration.16862.user.cozytvarchive.post.11176,1681447027,cozytvarchive,11176,,PaulTown Nick on Fresh and Fit HYPE STREAM + BLOKKA SOLO HYPE WAITING ROOM! Part 3 of 3,2023-07-08 08:24:11+00:00,https://t.me/cozytvarchive/11176,,,251,0,4,0,,,,,,,0,,,1,MessageMediaDocument,0,,,,,video/mp4,4.99234321891066e+18,11308.0,paultown-2023-07-08-part-2.mp4,,,,,,,,,,,,,,,
msg_iteration.16863.user.cozytvarchive.post.11175,1681447027,cozytvarchive,11175,,PaulTown Nick on Fresh and Fit HYPE STREAM + BLOKKA SOLO HYPE WAITING ROOM! Part 2 of 3,2023-07-08 08:13:52+00:00,https://t.me/cozytvarchive/11175,,,269,0,6,0,,,,,,,0,,,1,MessageMediaDocument,0,,,,,video/mp4,4.99234321891066e+18,11337.0,paultown-2023-07-08-part-1.mp4,,,,,,,,,,,,,,,
msg_iteration.16864.user.cozytvarchive.post.11174,1681447027,cozytvarchive,11174,,"PaulTown Nick on Fresh and Fit HYPE STREAM + BLOKKA SOLO HYPE WAITING ROOM! Part 1 of 3 07/07/2023 • 9 hour 26 minute stream • 1,134 peak viewers",2023-07-08 08:02:40+00:00,https://t.me/cozytvarchive/11174,,,281,0,4,0,,,,,,,0,,,1,MessageMediaDocument,0,,,,,video/mp4,4.99234321891066e+18,11338.0,paultown-2023-07-08-part-0.mp4,,,,,,,,,,,,,,,
msg_iteration.16865.user.cozytvarchive.post.11173,1681447027,cozytvarchive,11173,,DaltonClodfelter REACTIONARY RADIO: NICK ON FRESH AND FIT HYPE! ADAM22 SPEAKS OUT! STREAMER TRASHED GROCERY STORE! ZHERKA GOES OFF! Part 2 of 2,2023-07-08 04:19:35+00:00,https://t.me/cozytvarchive/11173,,,273,0,3,0,,,,,,,0,,,1,MessageMediaDocument,0,,,,,video/mp4,4.99234321891066e+18,9862.0,daltonclodfelter-2023-07-08-part-1.mp4,,,,,,,,,,,,,,,
msg_iteration.16866.user.cozytvarchive.post.11172,1681447027,cozytvarchive,11172,,DaltonClodfelter REACTIONARY RADIO: NICK ON FRESH AND FIT HYPE! ADAM22 SPEAKS OUT! STREAMER TRASHED GROCERY STORE! ZHERKA GOES OFF! Part 1 of 2 07/07/2023 • 5 hour 29 minute stream • 367 peak viewers,2023-07-08 04:09:56+00:00,https://t.me/cozytvarchive/11172,,,267,0,3,0,,,,,,,0,,,1,MessageMediaDocument,0,,,,,video/mp4,4.99234321891066e+18,9882.0,daltonclodfelter-2023-07-08-part-0.mp4,,,,,,,,,,,,,,,
msg_iteration.16867.user.cozytvarchive.post.11171,1681447027,cozytvarchive,11171,,TRSartor Drip University: Creating Demeanor through Details 07/07/2023 • 30 minute stream • 23 peak viewers,2023-07-08 02:50:59+00:00,https://t.me/cozytvarchive/11171,,,248,0,1,0,,,,,,,0,,,1,MessageMediaDocument,0,,,,,video/mp4,4.990091419096974e+18,1822.0,trsartor-2023-07-08_1.mp4,,,,,,,,,,,,,,,
msg_iteration.16868.user.cozytvarchive.post.11170,1681447027,cozytvarchive,11170,,TRSartor Drip University: Creating Demeanor through Details 07/07/2023 • stream • 3 peak viewers,2023-07-08 02:29:11+00:00,https://t.me/cozytvarchive/11170,,,216,0,0,0,,,,,,,0,,,1,MessageMediaDocument,0,,,,,video/mp4,4.990091419096974e+18,18.0,trsartor-2023-07-08.mp4,,,,,,,,,,,,,,,
msg_iteration.16869.user.cozytvarchive.post.11169,1681447027,cozytvarchive,11169,,JoeTheBoomer The Dirty Bastard Live with Joe The Boomer Part 3 of 3,2023-07-08 02:11:28+00:00,https://t.me/cozytvarchive/11169,,,208,0,0,0,,,,,,,0,,,1,MessageMediaDocument,0,,,,,video/mp4,4.990091419096974e+18,12009.0,joetheboomer-2023-07-08-part-2.mp4,,,,,,,,,,,,,,,
msg_iteration.16870.user.cozytvarchive.post.11168,1681447027,cozytvarchive,11168,,JoeTheBoomer The Dirty Bastard Live with Joe The Boomer Part 2 of 3,2023-07-08 02:01:24+00:00,https://t.me/cozytvarchive/11168,,,201,0,0,0,,,,,,,0,,,1,MessageMediaDocument,0,,,,,video/mp4,4.990091419096974e+18,12050.0,joetheboomer-2023-07-08-part-1.mp4,,,,,,,,,,,,,,,
msg_iteration.16871.user.cozytvarchive.post.11167,1681447027,cozytvarchive,11167,,JoeTheBoomer The Dirty Bastard Live with Joe The Boomer Part 1 of 3 07/07/2023 • 10 hour 1 minute stream • 36 peak viewers,2023-07-08 01:49:20+00:00,https://t.me/cozytvarchive/11167,,,194,0,0,0,,,,,,,0,,,1,MessageMediaDocument,0,,,,,video/mp4,4.990091419096974e+18,12050.0,joetheboomer-2023-07-08-part-0.mp4,,,,,,,,,,,,,,,
msg_iteration.16872.user.cozytvarchive.post.11166,1681447027,cozytvarchive,11166,,"StewPeters LIVE: NC Gov VETOES Bills BANNING Child Mutilation, JP Morgan Pays Off Epstein Trafficking Victims 07/07/2023 • 57 minute stream • 18 peak viewers",2023-07-07 23:47:26+00:00,https://t.me/cozytvarchive/11166,,,187,0,0,0,,,,,,,0,,,1,MessageMediaDocument,0,,,,,video/mp4,4.990091419096974e+18,3472.0,stewpeters-2023-07-07.mp4,,,,,,,,,,,,,,,
msg_iteration.16873.user.cozytvarchive.post.11165,1681447027,cozytvarchive,11165,,JimboZoomer JIMBO ZOOMER EXPERIENCE😍#1 REACTION STREAMER💥#1 ADHD GLAZER 🤯#1 NEWS SOURCE BROADCAST😲SOME SAY THE NEW SEAN HANNITY Part 3 of 3,2023-07-07 23:41:18+00:00,https://t.me/cozytvarchive/11165,,,184,0,1,0,,,,,,,0,,,1,MessageMediaDocument,0,,,,,video/mp4,4.990091419096974e+18,8733.0,jimbozoomer-2023-07-07-part-2.mp4,,,,,,,,,,,,,,,
msg_iteration.16874.user.cozytvarchive.post.11164,1681447027,cozytvarchive,11164,,JimboZoomer JIMBO ZOOMER EXPERIENCE😍#1 REACTION STREAMER💥#1 ADHD GLAZER 🤯#1 NEWS SOURCE BROADCAST😲SOME SAY THE NEW SEAN HANNITY Part 2 of 3,2023-07-07 23:32:24+00:00,https://t.me/cozytvarchive/11164,,,177,0,1,0,,,,,,,0,,,1,MessageMediaDocument,0,,,,,video/mp4,4.990091419096974e+18,8762.0,jimbozoomer-2023-07-07-part-1.mp4,,,,,,,,,,,,,,,
msg_iteration.16875.user.cozytvarchive.post.11163,1681447027,cozytvarchive,11163,,JimboZoomer JIMBO ZOOMER EXPERIENCE😍#1 REACTION STREAMER💥#1 ADHD GLAZER 🤯#1 NEWS SOURCE BROADCAST😲SOME SAY THE NEW SEAN HANNITY Part 1 of 3 07/07/2023 • 7 hour 17 minute stream • 222 peak viewers,2023-07-07 23:24:17+00:00,https://t.me/cozytvarchive/11163,,,196,0,1,0,,,,,,,0,,,1,MessageMediaDocument,0,,,,,video/mp4,4.990091419096974e+18,8762.0,jimbozoomer-2023-07-07-part-0.mp4,,,,,,,,,,,,,,,
msg_iteration.16876.user.cozytvarchive.post.11162,1681447027,cozytvarchive,11162,,EMichaelJones EMJ Live #32: The French Riots 07/07/2023 • 1 hour 31 minute stream • 395 peak viewers,2023-07-07 22:35:19+00:00,https://t.me/cozytvarchive/11162,,,273,0,5,0,,,,,,,0,,,1,MessageMediaDocument,0,,,,,video/mp4,4.990091419096974e+18,5503.0,emichaeljones-2023-07-07.mp4,,,,,,,,,,,,,,,
msg_iteration.16877.user.cozytvarchive.post.11161,1681447027,cozytvarchive,11161,,Stone Fmr. Trump Advisor Michael Caputo On How Robert Mueller & The FBI Tried To Set Him Up -The StoneZONE 07/07/2023 • 1 hour stream • 8 peak viewers,2023-07-07 22:08:59+00:00,https://t.me/cozytvarchive/11161,,,210,0,0,0,,,,,,,0,,,1,MessageMediaDocument,0,,,,,video/mp4,4.990091419096974e+18,3602.0,stone-2023-07-07.mp4,,,,,,,,,,,,,,,
msg_iteration.16878.user.cozytvarchive.post.11160,1681447027,cozytvarchive,11160,,JLP The Bus Life Show Joins Jesse! (Ep. 318) 07/07/2023 • 1 hour 30 minute stream • 32 peak viewers,2023-07-07 20:21:13+00:00,https://t.me/cozytvarchive/11160,,,213,0,0,0,,,,,,,0,,,1,MessageMediaDocument,0,,,,,video/mp4,4.990091419096974e+18,4976.0,jlp-2023-07-07_1.mp4,,,,,,,,,,,,,,,
msg_iteration.16879.user.cozytvarchive.post.11159,1681447027,cozytvarchive,11159,,CancelProof Tucker Carlson's 1st Post-FOX Interview 07/07/2023 • 2 hour stream • 62 peak viewers,2023-07-07 19:56:14+00:00,https://t.me/cozytvarchive/11159,,,211,0,2,0,,,,,,,0,,,1,MessageMediaDocument,0,,,,,video/mp4,4.990091419096974e+18,7257.0,cancelproof-2023-07-07.mp4,,,,,,,,,,,,,,,
msg_iteration.16880.user.cozytvarchive.post.11158,1681447027,cozytvarchive,11158,,"Dawson Mike Enoch, Mark Collet on NGO involvement in France 07/07/2023 • 1 hour 50 minute stream • 200 peak viewers",2023-07-07 17:29:04+00:00,https://t.me/cozytvarchive/11158,,,212,0,2,0,,,,,,,0,,,1,MessageMediaDocument,0,,,,,video/mp4,4.990091419096974e+18,6608.0,dawson-2023-07-07.mp4,,,,,,,,,,,,,,,
msg_iteration.16881.user.cozytvarchive.post.11157,1681447027,cozytvarchive,11157,,"Boseph GM, Maria! Part 2 of 2",2023-07-07 17:03:41+00:00,https://t.me/cozytvarchive/11157,,,207,0,0,0,,,,,,,0,,,1,MessageMediaDocument,0,,,,,video/mp4,4.990091419096974e+18,8399.0,boseph-2023-07-07_2-part-1.mp4,,,,,,,,,,,,,,,
msg_iteration.16882.user.cozytvarchive.post.11156,1681447027,cozytvarchive,11156,,"Boseph GM, Maria! Part 1 of 2 07/07/2023 • 4 hour 40 minute stream • 33 peak viewers",2023-07-07 16:58:23+00:00,https://t.me/cozytvarchive/11156,,,203,0,0,0,,,,,,,0,,,1,MessageMediaDocument,0,,,,,video/mp4,4.990091419096974e+18,8420.0,boseph-2023-07-07_2-part-0.mp4,,,,,,,,,,,,,,,
msg_iteration.16883.user.cozytvarchive.post.11155,1681447027,cozytvarchive,11155,,JLP 7/07/23 Fri. The Jesse Lee Peterson Show | 888-77-JESSE 07/07/2023 • 3 hour 25 minute stream • 64 peak viewers,2023-07-07 16:22:24+00:00,https://t.me/cozytvarchive/11155,,,196,0,0,0,,,,,,,0,,,1,MessageMediaDocument,0,,,,,video/mp4,4.990091419096974e+18,12014.0,jlp-2023-07-07.mp4,,,,,,,,,,,,,,,
msg_iteration.16884.user.cozytvarchive.post.11154,1681447027,cozytvarchive,11154,,"Boseph GM, Maria! 07/07/2023 • 6 minute stream • 17 peak viewers",2023-07-07 12:07:53+00:00,https://t.me/cozytvarchive/11154,,,197,0,0,0,,,,,,,0,,,1,MessageMediaDocument,0,,,,,video/mp4,4.990091419096974e+18,413.0,boseph-2023-07-07_1.mp4,,,,,,,,,,,,,,,
msg_iteration.16885.user.cozytvarchive.post.11153,1681447027,cozytvarchive,11153,,"Boseph GM, Maria! 07/07/2023 • 35 minute stream • 14 peak viewers",2023-07-07 12:07:02+00:00,https://t.me/cozytvarchive/11153,,,191,0,0,0,,,,,,,0,,,1,MessageMediaDocument,0,,,,,video/mp4,4.990091419096974e+18,2128.0,boseph-2023-07-07.mp4,,,,,,,,,,,,,,,
msg_iteration.16886.user.cozytvarchive.post.11152,1681447027,cozytvarchive,11152,,Veyta beating stupid game 07/07/2023 • 2 hour 14 minute stream • 73 peak viewers,2023-07-07 12:02:21+00:00,https://t.me/cozytvarchive/11152,,,191,0,0,0,,,,,,,0,,,1,MessageMediaDocument,0,,,,,video/mp4,4.990091419096974e+18,8096.0,veyta-2023-07-07.mp4,,,,,,,,,,,,,,,
msg_iteration.16887.user.cozytvarchive.post.11151,1681447027,cozytvarchive,11151,,TylerRussell TRANSRACIAL ADOPTEE DEATHMATCH! LAUREN CHEN CALLS OUT PEARL? AFCRAFT LATER ON TONIGHT! Thursday Night Content OVERLOAD 07/07/2023 • 44 minute stream • 84 peak viewers,2023-07-07 09:45:49+00:00,https://t.me/cozytvarchive/11151,,,204,0,3,0,,,,,,,0,,,1,MessageMediaDocument,0,,,,,video/mp4,4.990091419096974e+18,2674.0,tylerrussell-2023-07-07_1.mp4,,,,,,,,,,,,,,,
msg_iteration.16888.user.cozytvarchive.post.11150,1681447027,cozytvarchive,11150,,Loulz VEGAS on a THURSDAY! Part 2 of 2,2023-07-07 09:40:35+00:00,https://t.me/cozytvarchive/11150,,,184,0,0,0,,,,,,,0,,,1,MessageMediaDocument,0,,,,,video/mp4,4.990091419096974e+18,13185.0,loulz-2023-07-07-part-1.mp4,,,,,,,,,,,,,,,
msg_iteration.16889.user.cozytvarchive.post.11149,1681447027,cozytvarchive,11149,,Loulz VEGAS on a THURSDAY! Part 1 of 2 07/06/2023 • 7 hour 19 minute stream • 157 peak viewers,2023-07-07 09:30:55+00:00,https://t.me/cozytvarchive/11149,,,177,0,0,0,,,,,,,0,,,1,MessageMediaDocument,0,,,,,video/mp4,4.990091419096974e+18,13204.0,loulz-2023-07-07-part-0.mp4,,,,,,,,,,,,,,,
msg_iteration.16890.user.cozytvarchive.post.11148,1681447027,cozytvarchive,11148,,Tenryo The Vindication of the Magical Negro - Just Say It Edition 07/06/2023 • 3 hour 32 minute stream • 49 peak viewers,2023-07-07 09:02:23+00:00,https://t.me/cozytvarchive/11148,,,173,0,0,0,,,,,,,0,,,1,MessageMediaDocument,0,,,,,video/mp4,4.987839619283289e+18,12727.0,tenryo-2023-07-07.mp4,,,,,,,,,,,,,,,
msg_iteration.16891.user.cozytvarchive.post.11147,1681447027,cozytvarchive,11147,,TylerRussell TRANSRACIAL ADOPTEE DEATHMATCH! LAUREN CHEN CALLS OUT PEARL? AFCRAFT LATER ON TONIGHT! Thursday Night Content OVERLOAD Part 2 of 2,2023-07-07 08:41:23+00:00,https://t.me/cozytvarchive/11147,,,207,0,3,0,,,,,,,0,,,1,MessageMediaDocument,0,,,,,video/mp4,4.987839619283289e+18,5571.0,tylerrussell-2023-07-07-part-1.mp4,,,,,,,,,,,,,,,
msg_iteration.16892.user.cozytvarchive.post.11146,1681447027,cozytvarchive,11146,,TylerRussell TRANSRACIAL ADOPTEE DEATHMATCH! LAUREN CHEN CALLS OUT PEARL? AFCRAFT LATER ON TONIGHT! Thursday Night Content OVERLOAD Part 1 of 2 07/07/2023 • 3 hour 6 minute stream • 183 peak viewers,2023-07-07 08:35:35+00:00,https://t.me/cozytvarchive/11146,,,219,0,3,0,,,,,,,0,,,1,MessageMediaDocument,0,,,,,video/mp4,4.987839619283289e+18,5596.0,tylerrussell-2023-07-07-part-0.mp4,,,,,,,,,,,,,,,
msg_iteration.16893.user.cozytvarchive.post.11145,1681447027,cozytvarchive,11145,,Woozuh Loulz Vegas IRL! 07/06/2023 • 3 hour 40 minute stream • 21 peak viewers,2023-07-07 08:22:52+00:00,https://t.me/cozytvarchive/11145,,,207,0,0,0,,,,,,,0,,,1,MessageMediaDocument,0,,,,,video/mp4,4.987839619283289e+18,13238.0,woozuh-2023-07-07_1.mp4,,,,,,,,,,,,,,,
msg_iteration.16894.user.cozytvarchive.post.11144,1681447027,cozytvarchive,11144,,"Nick THREADS = GAY TWITTER: Zuckerberg Launches ""Twitter Killer"" App | America First Ep. 1188 07/06/2023 • 2 hour 24 minute stream • 6,476 peak viewers",2023-07-07 05:28:52+00:00,https://t.me/cozytvarchive/11144,,,221,0,2,0,,,,,,,0,,,1,MessageMediaDocument,0,,,,,video/mp4,4.990401137778625e+18,8687.0,nick-2023-07-07.mp4,,,,,,,,,,,,,,,
msg_iteration.16895.user.cozytvarchive.post.11143,1681447027,cozytvarchive,11143,,Wurzelroot WURSE WURLD: WRSWRLD: KWERZDAY: HELLO AND WELCOME TO MY SHOW! IT IS VERY COOL! CLICK NOW DONT MISS IT!! WEEE! 🤑😲😭 07/06/2023 • 4 hour 2 minute stream • 573 peak viewers,2023-07-07 03:37:16+00:00,https://t.me/cozytvarchive/11143,,,239,0,4,0,,,,,,,0,,,1,MessageMediaDocument,0,,,,,video/mp4,4.990401137778625e+18,14568.0,wurzelroot-2023-07-07.mp4,,,,,,,,,,,,,,,
msg_iteration.16896.user.cozytvarchive.post.11142,1681447027,cozytvarchive,11142,,EthanRalph KILLSTREAM: THE FAUSTIAN BARGAIN Part 2 of 2,2023-07-07 03:20:34+00:00,https://t.me/cozytvarchive/11142,,,225,0,0,0,,,,,,,0,,,1,MessageMediaDocument,0,,,,,video/mp4,4.990401137778625e+18,13799.0,ethanralph-2023-07-07-part-1.mp4,,,,,,,,,,,,,,,
msg_iteration.16897.user.cozytvarchive.post.11141,1681447027,cozytvarchive,11141,,EthanRalph KILLSTREAM: THE FAUSTIAN BARGAIN Part 1 of 2 07/06/2023 • 7 hour 40 minute stream • 615 peak viewers,2023-07-07 03:13:51+00:00,https://t.me/cozytvarchive/11141,,,227,0,0,0,,,,,,,0,,,1,MessageMediaDocument,0,,,,,video/mp4,4.990401137778625e+18,13820.0,ethanralph-2023-07-07-part-0.mp4,,,,,,,,,,,,,,,
msg_iteration.16898.user.cozytvarchive.post.11140,1681447027,cozytvarchive,11140,,Woozuh Loulz Vegas IRL! 07/06/2023 • 2 hour 55 minute stream • 37 peak viewers,2023-07-07 02:54:29+00:00,https://t.me/cozytvarchive/11140,,,215,0,0,0,,,,,,,0,,,1,MessageMediaDocument,0,,,,,video/mp4,4.990401137778625e+18,10531.0,woozuh-2023-07-07.mp4,,,,,,,,,,,,,,,
msg_iteration.16899.user.cozytvarchive.post.11139,1681447027,cozytvarchive,11139,,wendell book club 37 (america's protectionist takeoff p267+) 07/06/2023 • 2 hour 45 minute stream • 99 peak viewers,2023-07-07 02:40:12+00:00,https://t.me/cozytvarchive/11139,,,919,0,7,0,,,,,,,0,,,1,MessageMediaDocument,0,,,,,video/mp4,4.990401137778625e+18,9921.0,wendell-2023-07-07.mp4,,,,,,,,,,,,,,,
msg_iteration.16900.user.cozytvarchive.post.11138,1681447027,cozytvarchive,11138,,JoeTheBoomer JULY 4th SPECIAL edition of The Dirty Bastard Live with Joe The Boomer Part 4 of 4,2023-07-07 02:27:15+00:00,https://t.me/cozytvarchive/11138,,,194,0,0,0,,,,,,,0,,,1,MessageMediaDocument,0,,,,,video/mp4,4.990401137778625e+18,9687.0,joetheboomer-2023-07-07-part-3.mp4,,,,,,,,,,,,,,,
msg_iteration.16901.user.cozytvarchive.post.11137,1681447027,cozytvarchive,11137,,JoeTheBoomer JULY 4th SPECIAL edition of The Dirty Bastard Live with Joe The Boomer Part 3 of 4,2023-07-07 02:20:41+00:00,https://t.me/cozytvarchive/11137,,,190,0,0,0,,,,,,,0,,,1,MessageMediaDocument,0,,,,,video/mp4,4.990401137778625e+18,9733.0,joetheboomer-2023-07-07-part-2.mp4,,,,,,,,,,,,,,,
msg_iteration.16902.user.cozytvarchive.post.11136,1681447027,cozytvarchive,11136,,JoeTheBoomer JULY 4th SPECIAL edition of The Dirty Bastard Live with Joe The Boomer Part 2 of 4,2023-07-07 02:14:06+00:00,https://t.me/cozytvarchive/11136,,,185,0,0,0,,,,,,,0,,,1,MessageMediaDocument,0,,,,,video/mp4,4.990401137778625e+18,9725.0,joetheboomer-2023-07-07-part-1.mp4,,,,,,,,,,,,,,,
msg_iteration.16903.user.cozytvarchive.post.11135,1681447027,cozytvarchive,11135,,JoeTheBoomer JULY 4th SPECIAL edition of The Dirty Bastard Live with Joe The Boomer Part 1 of 4 07/06/2023 • 10 hour 47 minute stream • 65 peak viewers,2023-07-07 02:06:09+00:00,https://t.me/cozytvarchive/11135,,,189,0,0,0,,,,,,,0,,,1,MessageMediaDocument,0,,,,,video/mp4,4.990401137778625e+18,9733.0,joetheboomer-2023-07-07-part-0.mp4,,,,,,,,,,,,,,,
msg_iteration.16904.user.cozytvarchive.post.11134,1681447027,cozytvarchive,11134,,JimboZoomer JIMBO ZOOMER EXPERIENCE😍#1 REACTION STREAMER💥#1 ADHD GLAZER 🤯#1 NEWS SOURCE BROADCAST😲SOME SAY THE NEW SEAN HANNITY 07/06/2023 • 2 hour 52 minute stream • 560 peak viewers,2023-07-06 23:31:35+00:00,https://t.me/cozytvarchive/11134,,,203,0,1,0,,,,,,,0,,,1,MessageMediaDocument,0,,,,,video/mp4,4.988149337964937e+18,10329.0,jimbozoomer-2023-07-06.mp4,,,,,,,,,,,,,,,
msg_iteration.16905.user.cozytvarchive.post.11133,1681447027,cozytvarchive,11133,,"StewPeters LIVE: Tranny Terror Strikes Philadelphia, Hunter Biden's COKE HOUSE, Time To DEFUND The D.C. SWAMP 07/06/2023 • 57 minute stream • 18 peak viewers",2023-07-06 23:15:36+00:00,https://t.me/cozytvarchive/11133,,,211,0,0,0,,,,,,,0,,,1,MessageMediaDocument,0,,,,,video/mp4,4.988149337964937e+18,3433.0,stewpeters-2023-07-06.mp4,,,,,,,,,,,,,,,
msg_iteration.16906.user.cozytvarchive.post.11132,1681447027,cozytvarchive,11132,,Woozuh Loulz Vegas IRL! 07/06/2023 • 1 hour 22 minute stream • 59 peak viewers,2023-07-06 23:10:03+00:00,https://t.me/cozytvarchive/11132,,,208,0,0,0,,,,,,,0,,,1,MessageMediaDocument,0,,,,,video/mp4,4.988149337964937e+18,4943.0,woozuh-2023-07-06_1.mp4,,,,,,,,,,,,,,,
msg_iteration.16907.user.cozytvarchive.post.11131,1681447027,cozytvarchive,11131,,Stone Will Hunter Biden Skate? w/ Garrett Ziegler of Marco Polo - The StoneZONE 07/06/2023 • 58 minute stream • 9 peak viewers,2023-07-06 22:11:55+00:00,https://t.me/cozytvarchive/11131,,,214,0,0,0,,,,,,,0,,,1,MessageMediaDocument,0,,,,,video/mp4,4.988149337964937e+18,3501.0,stone-2023-07-06.mp4,,,,,,,,,,,,,,,
msg_iteration.16908.user.cozytvarchive.post.11130,1681447027,cozytvarchive,11130,,PatrickHowley White House Cocaine Mystery Continues | The Campaign Show 07/06/2023 • 44 minute stream • 31 peak viewers,2023-07-06 21:47:58+00:00,https://t.me/cozytvarchive/11130,,,226,0,2,0,,,,,,,0,,,1,MessageMediaDocument,0,,,,,video/mp4,4.988149337964937e+18,2684.0,patrickhowley-2023-07-06.mp4,,,,,,,,,,,,,,,
msg_iteration.16909.user.cozytvarchive.post.11129,1681447027,cozytvarchive,11129,,JLP 7/06/23 Thurs. The Jesse Lee Peterson Show | 888-77-JESSE 07/06/2023 • 3 hour 25 minute stream • 50 peak viewers,2023-07-06 16:20:40+00:00,https://t.me/cozytvarchive/11129,,,224,0,0,0,,,,,,,0,,,1,MessageMediaDocument,0,,,,,video/mp4,4.988149337964937e+18,12019.0,jlp-2023-07-06.mp4,,,,,,,,,,,,,,,
msg_iteration.16910.user.cozytvarchive.post.11128,1681447027,cozytvarchive,11128,,Tenryo Sup Groyps Part 2 of 2,2023-07-06 15:16:25+00:00,https://t.me/cozytvarchive/11128,,,212,0,0,0,,,,,,,0,,,1,MessageMediaDocument,0,,,,,video/mp4,4.988149337964937e+18,10211.0,tenryo-2023-07-06-part-1.mp4,,,,,,,,,,,,,,,
msg_iteration.16911.user.cozytvarchive.post.11127,1681447027,cozytvarchive,11127,,Tenryo Sup Groyps Part 1 of 2 07/06/2023 • 5 hour 40 minute stream • 33 peak viewers,2023-07-06 15:09:35+00:00,https://t.me/cozytvarchive/11127,,,205,0,0,0,,,,,,,0,,,1,MessageMediaDocument,0,,,,,video/mp4,4.988149337964937e+18,10232.0,tenryo-2023-07-06-part-0.mp4,,,,,,,,,,,,,,,
msg_iteration.16912.user.cozytvarchive.post.11126,1681447027,cozytvarchive,11126,,Veyta beating stupid game Part 2 of 2,2023-07-06 14:44:53+00:00,https://t.me/cozytvarchive/11126,,,194,0,0,0,,,,,,,0,,,1,MessageMediaDocument,0,,,,,video/mp4,4.988149337964937e+18,6833.0,veyta-2023-07-06-part-1.mp4,,,,,,,,,,,,,,,
msg_iteration.16913.user.cozytvarchive.post.11125,1681447027,cozytvarchive,11125,,Veyta beating stupid game Part 1 of 2 07/06/2023 • 3 hour 48 minute stream • 67 peak viewers,2023-07-06 14:39:24+00:00,https://t.me/cozytvarchive/11125,,,185,0,0,0,,,,,,,0,,,1,MessageMediaDocument,0,,,,,video/mp4,4.988149337964937e+18,6854.0,veyta-2023-07-06-part-0.mp4,,,,,,,,,,,,,,,
msg_iteration.16914.user.cozytvarchive.post.11124,1681447027,cozytvarchive,11124,,CrossTalkNews BIBLE STUDY: Acts 22 & Psalm 19 07/06/2023 • 1 hour 59 minute stream • 34 peak viewers,2023-07-06 14:23:15+00:00,https://t.me/cozytvarchive/11124,,,185,0,0,0,,,,,,,0,,,1,MessageMediaDocument,0,,,,,video/mp4,4.988149337964937e+18,7157.0,crosstalknews-2023-07-06.mp4,,,,,,,,,,,,,,,
msg_iteration.16915.user.cozytvarchive.post.11123,1681447027,cozytvarchive,11123,,Loulz VEGAS with WOOZUH and N8 + KEN Arrives Later Part 3 of 3,2023-07-06 14:10:19+00:00,https://t.me/cozytvarchive/11123,,,179,0,0,0,,,,,,,0,,,1,MessageMediaDocument,0,,,,,video/mp4,4.988149337964937e+18,14801.0,loulz-2023-07-06-part-2.mp4,,,,,,,,,,,,,,,
msg_iteration.16916.user.cozytvarchive.post.11122,1681447027,cozytvarchive,11122,,Loulz VEGAS with WOOZUH and N8 + KEN Arrives Later Part 2 of 3,2023-07-06 14:00:27+00:00,https://t.me/cozytvarchive/11122,,,185,0,0,0,,,,,,,0,,,1,MessageMediaDocument,0,,,,,video/mp4,4.988149337964937e+18,14831.0,loulz-2023-07-06-part-1.mp4,,,,,,,,,,,,,,,
msg_iteration.16917.user.cozytvarchive.post.11121,1681447027,cozytvarchive,11121,,Loulz VEGAS with WOOZUH and N8 + KEN Arrives Later Part 1 of 3 07/05/2023 • 12 hour 21 minute stream • 507 peak viewers,2023-07-06 13:49:29+00:00,https://t.me/cozytvarchive/11121,,,192,0,0,0,,,,,,,0,,,1,MessageMediaDocument,0,,,,,video/mp4,4.988149337964937e+18,14831.0,loulz-2023-07-06-part-0.mp4,,,,,,,,,,,,,,,
msg_iteration.16918.user.cozytvarchive.post.11120,1681447027,cozytvarchive,11120,,JoelDavis LIVE: White Man Under Siege 07/06/2023 • 1 hour 45 minute stream • 70 peak viewers,2023-07-06 12:08:48+00:00,https://t.me/cozytvarchive/11120,,,780,0,2,0,,,,,,,0,,,1,MessageMediaDocument,0,,,,,video/mp4,4.988149337964937e+18,6300.0,joeldavis-2023-07-06.mp4,,,,,,,,,,,,,,,
msg_iteration.16919.user.cozytvarchive.post.11119,1681447027,cozytvarchive,11119,,PoliticallyProvoked TRAD THOT CRUSADE 07/06/2023 • 1 hour 17 minute stream • 86 peak viewers,2023-07-06 09:53:27+00:00,https://t.me/cozytvarchive/11119,,,218,0,0,0,,,,,,,0,,,1,MessageMediaDocument,0,,,,,video/mp4,4.988149337964937e+18,4632.0,politicallyprovoked-2023-07-06_1.mp4,,,,,,,,,,,,,,,
msg_iteration.16920.user.cozytvarchive.post.11118,1681447027,cozytvarchive,11118,,Beardson Bad News #8: Meltdowns Galore Part 2 of 2,2023-07-06 09:46:57+00:00,https://t.me/cozytvarchive/11118,,,223,0,6,0,,,,,,,0,,,1,MessageMediaDocument,0,,,,,video/mp4,4.988149337964937e+18,13512.0,beardson-2023-07-06-part-1.mp4,,,,,,,,,,,,,,,
msg_iteration.16921.user.cozytvarchive.post.11117,1681447027,cozytvarchive,11117,,Beardson Bad News #8: Meltdowns Galore Part 1 of 2 07/05/2023 • 7 hour 30 minute stream • 625 peak viewers,2023-07-06 09:34:20+00:00,https://t.me/cozytvarchive/11117,,,223,0,6,0,,,,,,,0,,,1,MessageMediaDocument,0,,,,,video/mp4,4.988149337964937e+18,13532.0,beardson-2023-07-06-part-0.mp4,,,,,,,,,,,,,,,
msg_iteration.16922.user.cozytvarchive.post.11116,1681447027,cozytvarchive,11116,,BigTech BEANO McFEASO Part 2 of 2,2023-07-06 08:59:52+00:00,https://t.me/cozytvarchive/11116,,,333,0,1,0,,,,,,,0,,,1,MessageMediaDocument,0,,,,,video/mp4,4.988149337964937e+18,7881.0,bigtech-2023-07-06-part-1.mp4,,,,,,,,,,,,,,,
msg_iteration.16923.user.cozytvarchive.post.11115,1681447027,cozytvarchive,11115,,BigTech BEANO McFEASO Part 1 of 2 07/05/2023 • 4 hour 23 minute stream • 547 peak viewers,2023-07-06 08:54:19+00:00,https://t.me/cozytvarchive/11115,,,328,0,1,0,,,,,,,0,,,1,MessageMediaDocument,0,,,,,video/mp4,4.988149337964937e+18,7900.0,bigtech-2023-07-06-part-0.mp4,,,,,,,,,,,,,,,
msg_iteration.16924.user.cozytvarchive.post.11114,1681447027,cozytvarchive,11114,,Woozuh Loulz Vegas IRL! Part 2 of 2,2023-07-06 06:53:51+00:00,https://t.me/cozytvarchive/11114,,,213,0,0,0,,,,,,,0,,,1,MessageMediaDocument,0,,,,,video/mp4,4.985897538151253e+18,10083.0,woozuh-2023-07-06-part-1.mp4,,,,,,,,,,,,,,,
msg_iteration.16925.user.cozytvarchive.post.11113,1681447027,cozytvarchive,11113,,Woozuh Loulz Vegas IRL! Part 1 of 2 07/05/2023 • 5 hour 36 minute stream • 23 peak viewers,2023-07-06 06:45:41+00:00,https://t.me/cozytvarchive/11113,,,207,0,0,0,,,,,,,0,,,1,MessageMediaDocument,0,,,,,video/mp4,4.985897538151253e+18,10104.0,woozuh-2023-07-06-part-0.mp4,,,,,,,,,,,,,,,
msg_iteration.16926.user.cozytvarchive.post.11112,1681447027,cozytvarchive,11112,,wendell tokyo grift Part 2 of 2,2023-07-06 05:10:43+00:00,https://t.me/cozytvarchive/11112,,,888,0,3,0,,,,,,,0,,,1,MessageMediaDocument,0,,,,,video/mp4,4.985897538151253e+18,9564.0,wendell-2023-07-06-part-1.mp4,,,,,,,,,,,,,,,
msg_iteration.16927.user.cozytvarchive.post.11111,1681447027,cozytvarchive,11111,,wendell tokyo grift Part 1 of 2 07/05/2023 • 5 hour 19 minute stream • 155 peak viewers,2023-07-06 05:00:00+00:00,https://t.me/cozytvarchive/11111,,,870,0,4,0,,,,,,,0,,,1,MessageMediaDocument,0,,,,,video/mp4,4.985897538151253e+18,9597.0,wendell-2023-07-06-part-0.mp4,,,,,,,,,,,,,,,
msg_iteration.16928.user.cozytvarchive.post.11110,1681447027,cozytvarchive,11110,,PoliticallyProvoked LAST STREAM BEFORE WERE OFF FOR A WEEK Part 2 of 2,2023-07-06 04:37:28+00:00,https://t.me/cozytvarchive/11110,,,217,0,1,0,,,,,,,0,,,1,MessageMediaDocument,0,,,,,video/mp4,4.985897538151253e+18,10745.0,politicallyprovoked-2023-07-06-part-1.mp4,,,,,,,,,,,,,,,
msg_iteration.16929.user.cozytvarchive.post.11109,1681447027,cozytvarchive,11109,,PoliticallyProvoked LAST STREAM BEFORE WERE OFF FOR A WEEK Part 1 of 2 07/05/2023 • 5 hour 58 minute stream • 120 peak viewers,2023-07-06 04:28:02+00:00,https://t.me/cozytvarchive/11109,,,241,0,1,0,,,,,,,0,,,1,MessageMediaDocument,0,,,,,video/mp4,4.985897538151253e+18,10766.0,politicallyprovoked-2023-07-06-part-0.mp4,,,,,,,,,,,,,,,
msg_iteration.16930.user.cozytvarchive.post.11108,1681447027,cozytvarchive,11108,,TRSartor Fits For the Fittest: Dalton Clodfelter & Tyler Russell DOUBLE FEATURE 07/05/2023 • 1 hour 4 minute stream • 39 peak viewers,2023-07-06 03:12:52+00:00,https://t.me/cozytvarchive/11108,,,302,0,4,0,,,,,,,0,,,1,MessageMediaDocument,0,,,,,video/mp4,4.985897538151253e+18,3891.0,trsartor-2023-07-06.mp4,,,,,,,,,,,,,,,
msg_iteration.16931.user.cozytvarchive.post.11107,1681447027,cozytvarchive,11107,,EthanRalph KILLSTREAM: WIGGER WEDNESDAY Part 2 of 2,2023-07-06 02:49:36+00:00,https://t.me/cozytvarchive/11107,,,270,0,2,0,,,,,,,0,,,1,MessageMediaDocument,0,,,,,video/mp4,4.985897538151253e+18,15601.0,ethanralph-2023-07-06-part-1.mp4,,,,,,,,,,,,,,,
msg_iteration.16932.user.cozytvarchive.post.11106,1681447027,cozytvarchive,11106,,EthanRalph KILLSTREAM: WIGGER WEDNESDAY Part 1 of 2 07/05/2023 • 8 hour 40 minute stream • 606 peak viewers,2023-07-06 02:42:30+00:00,https://t.me/cozytvarchive/11106,,,272,0,2,0,,,,,,,0,,,1,MessageMediaDocument,0,,,,,video/mp4,4.985897538151253e+18,15620.0,ethanralph-2023-07-06-part-0.mp4,,,,,,,,,,,,,,,
msg_iteration.16933.user.cozytvarchive.post.11105,1681447027,cozytvarchive,11105,,DaltonClodfelter REACTIONARY RADIO: WTF IS GOING ON!?! PEARL W AGAIN! DALTON WAS SICK! FUENTES RALLY TWO HYPE! 07/05/2023 • 3 hour 12 minute stream • 603 peak viewers,2023-07-06 01:58:51+00:00,https://t.me/cozytvarchive/11105,,,286,0,6,0,,,,,,,0,,,1,MessageMediaDocument,0,,,,,video/mp4,4.985897538151253e+18,11564.0,daltonclodfelter-2023-07-06.mp4,,,,,,,,,,,,,,,
msg_iteration.16934.user.cozytvarchive.post.11103,1681447027,cozytvarchive,11103,,JoeTheBoomer JULY 4th SPECIAL edition of The Dirty Bastard Live with Joe The Boomer Part 3 of 3,2023-07-06 00:14:17+00:00,https://t.me/cozytvarchive/11103,,,227,0,0,0,,,,,,,0,,,1,MessageMediaDocument,0,,,,,video/mp4,4.985897538151253e+18,9949.0,joetheboomer-2023-07-05_1-part-2.mp4,,,,,,,,,,,,,,,
msg_iteration.16935.user.cozytvarchive.post.11102,1681447027,cozytvarchive,11102,,JoeTheBoomer JULY 4th SPECIAL edition of The Dirty Bastard Live with Joe The Boomer Part 2 of 3,2023-07-06 00:07:25+00:00,https://t.me/cozytvarchive/11102,,,198,0,0,0,,,,,,,0,,,1,MessageMediaDocument,0,,,,,video/mp4,4.985897538151253e+18,9975.0,joetheboomer-2023-07-05_1-part-1.mp4,,,,,,,,,,,,,,,
msg_iteration.16936.user.cozytvarchive.post.11101,1681447027,cozytvarchive,11101,,JoeTheBoomer JULY 4th SPECIAL edition of The Dirty Bastard Live with Joe The Boomer Part 1 of 3 07/05/2023 • 8 hour 18 minute stream • 53 peak viewers,2023-07-06 00:00:25+00:00,https://t.me/cozytvarchive/11101,,,179,0,0,0,,,,,,,0,,,1,MessageMediaDocument,0,,,,,video/mp4,4.985897538151253e+18,9983.0,joetheboomer-2023-07-05_1-part-0.mp4,,,,,,,,,,,,,,,
msg_iteration.16937.user.cozytvarchive.post.11100,1681447027,cozytvarchive,11100,,"StewPeters LIVE: SCOTUS Rejects Anti-White Affirmative Action, France BURNS, Biden's Student Loan Bailout BOMBS 07/05/2023 • 1 hour 5 minute stream • 10 peak viewers",2023-07-05 23:16:45+00:00,https://t.me/cozytvarchive/11100,,,181,0,0,0,,,,,,,0,,,1,MessageMediaDocument,0,,,,,video/mp4,4.985897538151253e+18,3905.0,stewpeters-2023-07-05.mp4,,,,,,,,,,,,,,,
msg_iteration.16938.user.cozytvarchive.post.11099,1681447027,cozytvarchive,11099,,Stone Kash Patel & Roger Stone Discuss The Latest BIDEN CRIME FAMILY COVER-UP - The StoneZONE 07/05/2023 • 59 minute stream • 13 peak viewers,2023-07-05 22:19:11+00:00,https://t.me/cozytvarchive/11099,,,183,0,0,0,,,,,,,0,,,1,MessageMediaDocument,0,,,,,video/mp4,4.985897538151253e+18,3563.0,stone-2023-07-05.mp4,,,,,,,,,,,,,,,
msg_iteration.16939.user.cozytvarchive.post.11098,1681447027,cozytvarchive,11098,,PatrickHowley Who Had The Coke At The White House? | The Campaign Show 07/05/2023 • 49 minute stream • 30 peak viewers,2023-07-05 21:54:37+00:00,https://t.me/cozytvarchive/11098,,,193,0,0,0,,,,,,,0,,,1,MessageMediaDocument,0,,,,,video/mp4,4.985897538151253e+18,2941.0,patrickhowley-2023-07-05.mp4,,,,,,,,,,,,,,,
msg_iteration.16940.user.cozytvarchive.post.11097,1681447027,cozytvarchive,11097,,Woozuh IRL Vegas 07/05/2023 • 1 hour 18 minute stream • 85 peak viewers,2023-07-05 20:19:09+00:00,https://t.me/cozytvarchive/11097,,,200,0,0,0,,,,,,,0,,,1,MessageMediaDocument,0,,,,,video/mp4,4.985897538151253e+18,4686.0,woozuh-2023-07-05_4.mp4,,,,,,,,,,,,,,,
msg_iteration.16941.user.cozytvarchive.post.11096,1681447027,cozytvarchive,11096,,"Boseph GM, Maria! Part 2 of 2",2023-07-05 20:12:17+00:00,https://t.me/cozytvarchive/11096,,,201,0,0,0,,,,,,,0,,,1,MessageMediaDocument,0,,,,,video/mp4,4.985897538151253e+18,10647.0,boseph-2023-07-05-part-1.mp4,,,,,,,,,,,,,,,
msg_iteration.16942.user.cozytvarchive.post.11095,1681447027,cozytvarchive,11095,,"Boseph GM, Maria! Part 1 of 2 07/05/2023 • 5 hour 55 minute stream • 29 peak viewers",2023-07-05 17:29:28+00:00,https://t.me/cozytvarchive/11095,,,207,0,0,0,,,,,,,0,,,1,MessageMediaDocument,0,,,,,video/mp4,4.98575345917834e+18,10666.0,boseph-2023-07-05-part-0.mp4,,,,,,,,,,,,,,,
msg_iteration.16943.user.cozytvarchive.post.11094,1681447027,cozytvarchive,11094,,JLP 7/05/23 Wed. The Jesse Lee Peterson Show | 888-77-JESSE 07/05/2023 • 3 hour 25 minute stream • 106 peak viewers,2023-07-05 16:29:31+00:00,https://t.me/cozytvarchive/11094,,,207,0,0,0,,,,,,,0,,,1,MessageMediaDocument,0,,,,,video/mp4,4.98575345917834e+18,12026.0,jlp-2023-07-05.mp4,,,,,,,,,,,,,,,
msg_iteration.16944.user.cozytvarchive.post.11093,1681447027,cozytvarchive,11093,,CrossTalkNews BIBLE STUDY: Acts 21 & Psalm 18 07/05/2023 • 1 hour 44 minute stream • 36 peak viewers,2023-07-05 13:24:59+00:00,https://t.me/cozytvarchive/11093,,,204,0,0,0,,,,,,,0,,,1,MessageMediaDocument,0,,,,,video/mp4,4.98575345917834e+18,6297.0,crosstalknews-2023-07-05.mp4,,,,,,,,,,,,,,,
msg_iteration.16945.user.cozytvarchive.post.11092,1681447027,cozytvarchive,11092,,Loulz 🎰JULY 4TH IN LOULZ VEGAS Part 2 of 2,2023-07-05 13:13:40+00:00,https://t.me/cozytvarchive/11092,,,199,0,0,0,,,,,,,0,,,1,MessageMediaDocument,0,,,,,video/mp4,4.98575345917834e+18,12030.0,loulz-2023-07-05_1-part-1.mp4,,,,,,,,,,,,,,,
msg_iteration.16946.user.cozytvarchive.post.11091,1681447027,cozytvarchive,11091,,Loulz 🎰JULY 4TH IN LOULZ VEGAS Part 1 of 2 07/05/2023 • 6 hour 41 minute stream • 118 peak viewers,2023-07-05 13:04:36+00:00,https://t.me/cozytvarchive/11091,,,182,0,0,0,,,,,,,0,,,1,MessageMediaDocument,0,,,,,video/mp4,4.98575345917834e+18,12052.0,loulz-2023-07-05_1-part-0.mp4,,,,,,,,,,,,,,,
msg_iteration.16947.user.cozytvarchive.post.11090,1681447027,cozytvarchive,11090,,Veyta daily streamer is back Part 2 of 2,2023-07-05 12:34:04+00:00,https://t.me/cozytvarchive/11090,,,168,0,0,0,,,,,,,0,,,1,MessageMediaDocument,0,,,,,video/mp4,4.98575345917834e+18,7400.0,veyta-2023-07-05-part-1.mp4,,,,,,,,,,,,,,,
msg_iteration.16948.user.cozytvarchive.post.11089,1681447027,cozytvarchive,11089,,Veyta daily streamer is back Part 1 of 2 07/05/2023 • 4 hour 7 minute stream • 111 peak viewers,2023-07-05 12:24:37+00:00,https://t.me/cozytvarchive/11089,,,176,0,0,0,,,,,,,0,,,1,MessageMediaDocument,0,,,,,video/mp4,4.98575345917834e+18,7420.0,veyta-2023-07-05-part-0.mp4,,,,,,,,,,,,,,,
msg_iteration.16949.user.cozytvarchive.post.11088,1681447027,cozytvarchive,11088,,Woozuh IRL Vegas Part 2 of 2,2023-07-05 12:02:34+00:00,https://t.me/cozytvarchive/11088,,,180,0,0,0,,,,,,,0,,,1,MessageMediaDocument,0,,,,,video/mp4,4.98575345917834e+18,7936.0,woozuh-2023-07-05_3-part-1.mp4,,,,,,,,,,,,,,,
msg_iteration.16950.user.cozytvarchive.post.11087,1681447027,cozytvarchive,11087,,Woozuh IRL Vegas Part 1 of 2 07/05/2023 • 4 hour 24 minute stream • 78 peak viewers,2023-07-05 11:55:20+00:00,https://t.me/cozytvarchive/11087,,,181,0,0,0,,,,,,,0,,,1,MessageMediaDocument,0,,,,,video/mp4,4.98575345917834e+18,7956.0,woozuh-2023-07-05_3-part-0.mp4,,,,,,,,,,,,,,,
msg_iteration.16951.user.cozytvarchive.post.11086,1681447027,cozytvarchive,11086,,"Nick RYAN DAWSON EXPOSED??? ""REAL"" Anti-Semite ANNIHILATES Atheist Liberal Poser | America First Ep. 1187 07/05/2023 • 1 hour 47 minute stream • 5,450 peak viewers",2023-07-05 07:50:06+00:00,https://t.me/cozytvarchive/11086,,,195,0,2,0,,,,,,,0,,,1,MessageMediaDocument,0,,,,,video/mp4,4.983501659364656e+18,6432.0,nick-2023-07-05.mp4,,,,,,,,,,,,,,,
msg_iteration.16952.user.cozytvarchive.post.11085,1681447027,cozytvarchive,11085,,Woozuh IRL Vegas 07/05/2023 • 32 minute stream • 576 peak viewers,2023-07-05 07:43:34+00:00,https://t.me/cozytvarchive/11085,,,192,0,0,0,,,,,,,0,,,1,MessageMediaDocument,0,,,,,video/mp4,4.983501659364656e+18,1935.0,woozuh-2023-07-05_2.mp4,,,,,,,,,,,,,,,
msg_iteration.16953.user.cozytvarchive.post.11084,1681447027,cozytvarchive,11084,,PoliticallyProvoked 4TH OF JULY HAS BEEN CANCELED 07/04/2023 • 3 hour 36 minute stream • 170 peak viewers,2023-07-05 07:39:44+00:00,https://t.me/cozytvarchive/11084,,,180,0,0,0,,,,,,,0,,,1,MessageMediaDocument,0,,,,,video/mp4,4.983501659364656e+18,12961.0,politicallyprovoked-2023-07-05.mp4,,,,,,,,,,,,,,,
msg_iteration.16954.user.cozytvarchive.post.11083,1681447027,cozytvarchive,11083,,Loulz 🎰JULY 4TH IN LOULZ VEGAS 07/04/2023 • 1 hour 35 minute stream • 92 peak viewers,2023-07-05 07:22:32+00:00,https://t.me/cozytvarchive/11083,,,168,0,0,0,,,,,,,0,,,1,MessageMediaDocument,0,,,,,video/mp4,4.983501659364656e+18,5727.0,loulz-2023-07-05.mp4,,,,,,,,,,,,,,,
msg_iteration.16955.user.cozytvarchive.post.11082,1681447027,cozytvarchive,11082,,Woozuh IRL Vegas 07/04/2023 • 48 minute stream • 645 peak viewers,2023-07-05 07:15:58+00:00,https://t.me/cozytvarchive/11082,,,173,0,0,0,,,,,,,0,,,1,MessageMediaDocument,0,,,,,video/mp4,4.983501659364656e+18,2915.0,woozuh-2023-07-05_1.mp4,,,,,,,,,,,,,,,
msg_iteration.16956.user.cozytvarchive.post.11081,1681447027,cozytvarchive,11081,,EthanRalph KILLSTREAM: JULY 4TH SUPERSHOW CUCK SPECTACULAR Part 3 of 3,2023-07-05 07:12:42+00:00,https://t.me/cozytvarchive/11081,,,174,0,1,0,,,,,,,0,,,1,MessageMediaDocument,0,,,,,video/mp4,4.983501659364656e+18,13785.0,ethanralph-2023-07-05-part-2.mp4,,,,,,,,,,,,,,,
msg_iteration.16957.user.cozytvarchive.post.11080,1681447027,cozytvarchive,11080,,EthanRalph KILLSTREAM: JULY 4TH SUPERSHOW CUCK SPECTACULAR Part 2 of 3,2023-07-05 07:04:02+00:00,https://t.me/cozytvarchive/11080,,,161,0,1,0,,,,,,,0,,,1,MessageMediaDocument,0,,,,,video/mp4,4.983501659364656e+18,13815.0,ethanralph-2023-07-05-part-1.mp4,,,,,,,,,,,,,,,
msg_iteration.16958.user.cozytvarchive.post.11079,1681447027,cozytvarchive,11079,,EthanRalph KILLSTREAM: JULY 4TH SUPERSHOW CUCK SPECTACULAR Part 1 of 3 07/04/2023 • 11 hour 30 minute stream • 645 peak viewers,2023-07-05 06:56:10+00:00,https://t.me/cozytvarchive/11079,,,159,0,1,0,,,,,,,0,,,1,MessageMediaDocument,0,,,,,video/mp4,4.983501659364656e+18,13814.0,ethanralph-2023-07-05-part-0.mp4,,,,,,,,,,,,,,,
msg_iteration.16959.user.cozytvarchive.post.11078,1681447027,cozytvarchive,11078,,Tenryo Watching Dragonball AI on the 4th of July (bars) 07/04/2023 • 1 hour 50 minute stream • 26 peak viewers,2023-07-05 06:27:35+00:00,https://t.me/cozytvarchive/11078,,,164,0,0,0,,,,,,,0,,,1,MessageMediaDocument,0,,,,,video/mp4,4.983501659364656e+18,6636.0,tenryo-2023-07-05.mp4,,,,,,,,,,,,,,,
msg_iteration.16960.user.cozytvarchive.post.11077,1681447027,cozytvarchive,11077,,Woozuh IRL Vegas 07/04/2023 • 2 hour 59 minute stream • 640 peak viewers,2023-07-05 06:16:17+00:00,https://t.me/cozytvarchive/11077,,,156,0,0,0,,,,,,,0,,,1,MessageMediaDocument,0,,,,,video/mp4,4.983501659364656e+18,10793.0,woozuh-2023-07-05.mp4,,,,,,,,,,,,,,,
msg_iteration.16961.user.cozytvarchive.post.11076,1681447027,cozytvarchive,11076,,JoeTheBoomer JULY 4th SPECIAL edition of The Dirty Bastard Live with Joe The Boomer Part 4 of 4,2023-07-05 05:59:12+00:00,https://t.me/cozytvarchive/11076,,,152,0,0,0,,,,,,,0,,,1,MessageMediaDocument,0,,,,,video/mp4,4.983501659364656e+18,10194.0,joetheboomer-2023-07-05-part-3.mp4,,,,,,,,,,,,,,,
msg_iteration.16962.user.cozytvarchive.post.11075,1681447027,cozytvarchive,11075,,JoeTheBoomer JULY 4th SPECIAL edition of The Dirty Bastard Live with Joe The Boomer Part 3 of 4,2023-07-05 05:48:06+00:00,https://t.me/cozytvarchive/11075,,,155,0,0,0,,,,,,,0,,,1,MessageMediaDocument,0,,,,,video/mp4,4.983501659364656e+18,10241.0,joetheboomer-2023-07-05-part-2.mp4,,,,,,,,,,,,,,,
msg_iteration.16963.user.cozytvarchive.post.11074,1681447027,cozytvarchive,11074,,JoeTheBoomer JULY 4th SPECIAL edition of The Dirty Bastard Live with Joe The Boomer Part 2 of 4,2023-07-05 05:37:10+00:00,https://t.me/cozytvarchive/11074,,,156,0,0,0,,,,,,,0,,,1,MessageMediaDocument,0,,,,,video/mp4,4.983501659364656e+18,10241.0,joetheboomer-2023-07-05-part-1.mp4,,,,,,,,,,,,,,,
msg_iteration.16964.user.cozytvarchive.post.11073,1681447027,cozytvarchive,11073,,JoeTheBoomer JULY 4th SPECIAL edition of The Dirty Bastard Live with Joe The Boomer Part 1 of 4 07/04/2023 • 11 hour 21 minute stream • 43 peak viewers,2023-07-05 05:27:06+00:00,https://t.me/cozytvarchive/11073,,,156,0,0,0,,,,,,,0,,,1,MessageMediaDocument,0,,,,,video/mp4,4.983501659364656e+18,10241.0,joetheboomer-2023-07-05-part-0.mp4,,,,,,,,,,,,,,,
msg_iteration.16965.user.cozytvarchive.post.11072,1681447027,cozytvarchive,11072,,Beardson 4th of july chillin 07/04/2023 • 3 hour 29 minute stream • 292 peak viewers,2023-07-05 04:56:00+00:00,https://t.me/cozytvarchive/11072,,,158,0,3,0,,,,,,,0,,,1,MessageMediaDocument,0,,,,,video/mp4,4.983501659364656e+18,12579.0,beardson-2023-07-05.mp4,,,,,,,,,,,,,,,
msg_iteration.16966.user.cozytvarchive.post.11071,1681447027,cozytvarchive,11071,,"StewPeters LIVE: BBC Doesn't Want You To See This: Stew Peters Goes Head-To-Head with BBC, WATCH FULL Interview 07/04/2023 • 1 hour 5 minute stream • 18 peak viewers",2023-07-05 04:41:09+00:00,https://t.me/cozytvarchive/11071,,,165,0,0,0,,,,,,,0,,,1,MessageMediaDocument,0,,,,,video/mp4,4.983501659364656e+18,3909.0,stewpeters-2023-07-04.mp4,,,,,,,,,,,,,,,
msg_iteration.16967.user.cozytvarchive.post.11070,1681447027,cozytvarchive,11070,,Stone THE FUGAZI CASE AGAINST ANDREW AND TRISTAN TATE w/ Their Attorney Joseph McBride - The StoneZONE 07/04/2023 • 59 minute stream • 9 peak viewers,2023-07-05 04:36:19+00:00,https://t.me/cozytvarchive/11070,,,164,0,1,0,,,,,,,0,,,1,MessageMediaDocument,0,,,,,video/mp4,4.983501659364656e+18,3555.0,stone-2023-07-04.mp4,,,,,,,,,,,,,,,
msg_iteration.16968.user.cozytvarchive.post.11068,1681447027,cozytvarchive,11068,,PaulTown AMERICANS ONLY GOODBYE MEGASTREAM NO EUROCUCKS ALLOWED Part 2 of 2,2023-07-05 04:19:24+00:00,https://t.me/cozytvarchive/11068,,,178,0,3,0,,,,,,,0,,,1,MessageMediaDocument,0,,,,,video/mp4,4.983501659364656e+18,10343.0,paultown-2023-07-04_1-part-1.mp4,,,,,,,,,,,,,,,
msg_iteration.16969.user.cozytvarchive.post.11067,1681447027,cozytvarchive,11067,,PaulTown AMERICANS ONLY GOODBYE MEGASTREAM NO EUROCUCKS ALLOWED Part 1 of 2 07/04/2023 • 5 hour 45 minute stream • 600 peak viewers,2023-07-05 04:11:45+00:00,https://t.me/cozytvarchive/11067,,,182,0,3,0,,,,,,,0,,,1,MessageMediaDocument,0,,,,,video/mp4,4.983501659364656e+18,10366.0,paultown-2023-07-04_1-part-0.mp4,,,,,,,,,,,,,,,
msg_iteration.16970.user.cozytvarchive.post.11066,1681447027,cozytvarchive,11066,,CancelProof Editing Movies on the 4th! 07/04/2023 • 2 hour 29 minute stream • 10 peak viewers,2023-07-05 03:53:25+00:00,https://t.me/cozytvarchive/11066,,,178,0,1,0,,,,,,,0,,,1,MessageMediaDocument,0,,,,,video/mp4,4.983501659364656e+18,8997.0,cancelproof-2023-07-04_1.mp4,,,,,,,,,,,,,,,
msg_iteration.16971.user.cozytvarchive.post.11065,1681447027,cozytvarchive,11065,,"Boseph GM, Maria! Part 2 of 2",2023-07-05 03:42:46+00:00,https://t.me/cozytvarchive/11065,,,177,0,0,0,,,,,,,0,,,1,MessageMediaDocument,0,,,,,video/mp4,4.983501659364656e+18,10623.0,boseph-2023-07-04-part-1.mp4,,,,,,,,,,,,,,,
msg_iteration.16972.user.cozytvarchive.post.11064,1681447027,cozytvarchive,11064,,"Boseph GM, Maria! Part 1 of 2 07/04/2023 • 5 hour 54 minute stream • 27 peak viewers",2023-07-05 03:36:34+00:00,https://t.me/cozytvarchive/11064,,,184,0,0,0,,,,,,,0,,,1,MessageMediaDocument,0,,,,,video/mp4,4.983501659364656e+18,10642.0,boseph-2023-07-04-part-0.mp4,,,,,,,,,,,,,,,
msg_iteration.16973.user.cozytvarchive.post.11063,1681447027,cozytvarchive,11063,,JLP 7/04/23 Mon. The Jesse Lee Peterson Show | 888-77-JESSE 07/04/2023 • 3 hour 23 minute stream • 45 peak viewers,2023-07-05 03:19:05+00:00,https://t.me/cozytvarchive/11063,,,200,0,0,0,,,,,,,0,,,1,MessageMediaDocument,0,,,,,video/mp4,4.983501659364656e+18,12040.0,jlp-2023-07-04.mp4,,,,,,,,,,,,,,,
msg_iteration.16974.user.cozytvarchive.post.11062,1681447027,cozytvarchive,11062,,CrossTalkNews BIBLE STUDY: Acts 20 & Psalm 17 07/04/2023 • 1 hour 24 minute stream • 32 peak viewers,2023-07-05 03:06:47+00:00,https://t.me/cozytvarchive/11062,,,229,0,0,0,,,,,,,0,,,1,MessageMediaDocument,0,,,,,video/mp4,4.983501659364656e+18,5063.0,crosstalknews-2023-07-04.mp4,,,,,,,,,,,,,,,
msg_iteration.16975.user.cozytvarchive.post.11061,1681447027,cozytvarchive,11061,,Veyta spooky zogtent Part 2 of 2,2023-07-05 03:00:04+00:00,https://t.me/cozytvarchive/11061,,,240,0,2,0,,,,,,,0,,,1,MessageMediaDocument,0,,,,,video/mp4,4.983501659364656e+18,6923.0,veyta-2023-07-04-part-1.mp4,,,,,,,,,,,,,,,
msg_iteration.16976.user.cozytvarchive.post.11060,1681447027,cozytvarchive,11060,,Veyta spooky zogtent Part 1 of 2 07/04/2023 • 3 hour 51 minute stream • 58 peak viewers,2023-07-05 02:54:18+00:00,https://t.me/cozytvarchive/11060,,,267,0,2,0,,,,,,,0,,,1,MessageMediaDocument,0,,,,,video/mp4,4.983501659364656e+18,6945.0,veyta-2023-07-04-part-0.mp4,,,,,,,,,,,,,,,
msg_iteration.16977.user.cozytvarchive.post.11059,1681447027,cozytvarchive,11059,,Beardson late night omegle 07/04/2023 • 3 hour 29 minute stream • 314 peak viewers,2023-07-04 09:37:55+00:00,https://t.me/cozytvarchive/11059,,,299,0,2,0,,,,,,,0,,,1,MessageMediaDocument,0,,,,,video/mp4,4.981249859550971e+18,12595.0,beardson-2023-07-04.mp4,,,,,,,,,,,,,,,
msg_iteration.16978.user.cozytvarchive.post.11058,1681447027,cozytvarchive,11058,,PaulTown PTH 267: 🤓 ERMMM 🤓 THE 🤓 MATRIX Part 2 of 2,2023-07-04 07:53:20+00:00,https://t.me/cozytvarchive/11058,,,482,0,4,0,,,,,,,0,,,1,MessageMediaDocument,0,,,,,video/mp4,4.981249859550971e+18,8023.0,paultown-2023-07-04-part-1.mp4,,,,,,,,,,,,,,,
msg_iteration.16979.user.cozytvarchive.post.11057,1681447027,cozytvarchive,11057,,PaulTown PTH 267: 🤓 ERMMM 🤓 THE 🤓 MATRIX Part 1 of 2 07/03/2023 • 4 hour 27 minute stream • 262 peak viewers,2023-07-04 07:45:41+00:00,https://t.me/cozytvarchive/11057,,,460,0,4,0,,,,,,,0,,,1,MessageMediaDocument,0,,,,,video/mp4,4.981249859550971e+18,8044.0,paultown-2023-07-04-part-0.mp4,,,,,,,,,,,,,,,
msg_iteration.16980.user.cozytvarchive.post.11056,1681447027,cozytvarchive,11056,,BigTech GEARHEAD SPECIAL EDITION 07/03/2023 • 3 hour 29 minute stream • 332 peak viewers,2023-07-04 07:24:05+00:00,https://t.me/cozytvarchive/11056,,,379,0,1,0,,,,,,,0,,,1,MessageMediaDocument,0,,,,,video/mp4,4.981249859550971e+18,12568.0,bigtech-2023-07-04.mp4,,,,,,,,,,,,,,,
msg_iteration.16981.user.cozytvarchive.post.11055,1681447027,cozytvarchive,11055,,"Nick MATRIX ATTACK: Tristan Tate EVADES Jewish Question, Attacks Redpilled ""INCEL"" Leader | America First Ep. 1186 07/03/2023 • 2 hour 19 minute stream • 6,339 peak viewers",2023-07-04 06:27:05+00:00,https://t.me/cozytvarchive/11055,,,247,0,2,0,,,,,,,0,,,1,MessageMediaDocument,0,,,,,video/mp4,4.978731350858138e+18,8356.0,nick-2023-07-04.mp4,,,,,,,,,,,,,,,
msg_iteration.16982.user.cozytvarchive.post.11053,1681447027,cozytvarchive,11053,,CancelProof Editing & Chill: Come Hang Out 07/03/2023 • 1 hour 5 minute stream • 10 peak viewers,2023-07-04 06:03:49+00:00,https://t.me/cozytvarchive/11053,,,227,0,1,0,,,,,,,0,,,1,MessageMediaDocument,0,,,,,video/mp4,4.978731350858138e+18,3943.0,cancelproof-2023-07-04.mp4,,,,,,,,,,,,,,,
msg_iteration.16983.user.cozytvarchive.post.11052,1681447027,cozytvarchive,11052,,PoliticallyProvoked BLACKFISH 07/03/2023 • 3 hour 40 minute stream • 184 peak viewers,2023-07-04 05:58:11+00:00,https://t.me/cozytvarchive/11052,,,213,0,0,0,,,,,,,0,,,1,MessageMediaDocument,0,,,,,video/mp4,4.978731350858138e+18,13252.0,politicallyprovoked-2023-07-04.mp4,,,,,,,,,,,,,,,
msg_iteration.16984.user.cozytvarchive.post.11051,1681447027,cozytvarchive,11051,,TylerRussell 24 HOUR STREAM Part 9 of 9,2023-07-04 05:40:54+00:00,https://t.me/cozytvarchive/11051,,,199,0,0,0,,,,,,,0,,,1,MessageMediaDocument,0,,,,,video/mp4,4.978731350858138e+18,9519.0,tylerrussell-2023-07-04-part-8.mp4,,,,,,,,,,,,,,,
msg_iteration.16985.user.cozytvarchive.post.11050,1681447027,cozytvarchive,11050,,TylerRussell 24 HOUR STREAM Part 8 of 9,2023-07-04 05:30:05+00:00,https://t.me/cozytvarchive/11050,,,180,0,0,0,,,,,,,0,,,1,MessageMediaDocument,0,,,,,video/mp4,4.978731350858138e+18,9597.0,tylerrussell-2023-07-04-part-7.mp4,,,,,,,,,,,,,,,
msg_iteration.16986.user.cozytvarchive.post.11049,1681447027,cozytvarchive,11049,,TylerRussell 24 HOUR STREAM Part 7 of 9,2023-07-04 05:18:41+00:00,https://t.me/cozytvarchive/11049,,,174,0,0,0,,,,,,,0,,,1,MessageMediaDocument,0,,,,,video/mp4,4.978731350858138e+18,9608.0,tylerrussell-2023-07-04-part-6.mp4,,,,,,,,,,,,,,,
msg_iteration.16987.user.cozytvarchive.post.11048,1681447027,cozytvarchive,11048,,TylerRussell 24 HOUR STREAM Part 6 of 9,2023-07-04 05:06:55+00:00,https://t.me/cozytvarchive/11048,,,168,0,0,0,,,,,,,0,,,1,MessageMediaDocument,0,,,,,video/mp4,4.978731350858138e+18,9604.0,tylerrussell-2023-07-04-part-5.mp4,,,,,,,,,,,,,,,
msg_iteration.16988.user.cozytvarchive.post.11047,1681447027,cozytvarchive,11047,,TylerRussell 24 HOUR STREAM Part 5 of 9,2023-07-04 04:56:03+00:00,https://t.me/cozytvarchive/11047,,,163,0,0,0,,,,,,,0,,,1,MessageMediaDocument,0,,,,,video/mp4,4.978731350858138e+18,9612.0,tylerrussell-2023-07-04-part-4.mp4,,,,,,,,,,,,,,,
msg_iteration.16989.user.cozytvarchive.post.11046,1681447027,cozytvarchive,11046,,TylerRussell 24 HOUR STREAM Part 4 of 9,2023-07-04 04:46:00+00:00,https://t.me/cozytvarchive/11046,,,163,0,0,0,,,,,,,0,,,1,MessageMediaDocument,0,,,,,video/mp4,4.978731350858138e+18,9603.0,tylerrussell-2023-07-04-part-3.mp4,,,,,,,,,,,,,,,
msg_iteration.16990.user.cozytvarchive.post.11045,1681447027,cozytvarchive,11045,,TylerRussell 24 HOUR STREAM Part 3 of 9,2023-07-04 04:35:57+00:00,https://t.me/cozytvarchive/11045,,,171,0,0,0,,,,,,,0,,,1,MessageMediaDocument,0,,,,,video/mp4,4.978731350858138e+18,9607.0,tylerrussell-2023-07-04-part-2.mp4,,,,,,,,,,,,,,,
msg_iteration.16991.user.cozytvarchive.post.11044,1681447027,cozytvarchive,11044,,TylerRussell 24 HOUR STREAM Part 2 of 9,2023-07-04 04:26:26+00:00,https://t.me/cozytvarchive/11044,,,180,0,0,0,,,,,,,0,,,1,MessageMediaDocument,0,,,,,video/mp4,4.978731350858138e+18,9602.0,tylerrussell-2023-07-04-part-1.mp4,,,,,,,,,,,,,,,
msg_iteration.16992.user.cozytvarchive.post.11043,1681447027,cozytvarchive,11043,,TylerRussell 24 HOUR STREAM Part 1 of 9 07/02/2023 • 23 hour 59 minute stream • 232 peak viewers,2023-07-04 04:16:17+00:00,https://t.me/cozytvarchive/11043,,,189,0,0,0,,,,,,,0,,,1,MessageMediaDocument,0,,,,,video/mp4,4.978731350858138e+18,9611.0,tylerrussell-2023-07-04-part-0.mp4,,,,,,,,,,,,,,,
msg_iteration.16993.user.cozytvarchive.post.11042,1681447027,cozytvarchive,11042,,JoeTheBoomer The Dirty Bastard Live with Joe The Boomer Part 3 of 3,2023-07-04 02:10:53+00:00,https://t.me/cozytvarchive/11042,,,194,0,0,0,,,,,,,0,,,1,MessageMediaDocument,0,,,,,video/mp4,4.978731350858138e+18,12136.0,joetheboomer-2023-07-04-part-2.mp4,,,,,,,,,,,,,,,
msg_iteration.16994.user.cozytvarchive.post.11041,1681447027,cozytvarchive,11041,,JoeTheBoomer The Dirty Bastard Live with Joe The Boomer Part 2 of 3,2023-07-04 02:01:09+00:00,https://t.me/cozytvarchive/11041,,,196,0,0,0,,,,,,,0,,,1,MessageMediaDocument,0,,,,,video/mp4,4.978731350858138e+18,12175.0,joetheboomer-2023-07-04-part-1.mp4,,,,,,,,,,,,,,,
msg_iteration.16995.user.cozytvarchive.post.11040,1681447027,cozytvarchive,11040,,JoeTheBoomer The Dirty Bastard Live with Joe The Boomer Part 1 of 3 07/03/2023 • 10 hour 8 minute stream • 34 peak viewers,2023-07-04 01:50:50+00:00,https://t.me/cozytvarchive/11040,,,198,0,0,0,,,,,,,0,,,1,MessageMediaDocument,0,,,,,video/mp4,4.978731350858138e+18,12175.0,joetheboomer-2023-07-04-part-0.mp4,,,,,,,,,,,,,,,
msg_iteration.16996.user.cozytvarchive.post.11039,1681447027,cozytvarchive,11039,,KingKnub Best One Armed Gamer GAMING 07/03/2023 • 46 minute stream • 12 peak viewers,2023-07-04 00:57:11+00:00,https://t.me/cozytvarchive/11039,,,190,0,0,0,,,,,,,0,,,1,MessageMediaDocument,0,,,,,video/mp4,4.978731350858138e+18,2804.0,kingknub-2023-07-04.mp4,,,,,,,,,,,,,,,
msg_iteration.16997.user.cozytvarchive.post.11038,1681447027,cozytvarchive,11038,,Beardson Red Pill War 07/03/2023 • 3 hour 22 minute stream • 598 peak viewers,2023-07-03 23:27:22+00:00,https://t.me/cozytvarchive/11038,,,200,0,4,0,,,,,,,0,,,1,MessageMediaDocument,0,,,,,video/mp4,4.978731350858138e+18,12175.0,beardson-2023-07-03.mp4,,,,,,,,,,,,,,,
msg_iteration.16998.user.cozytvarchive.post.11037,1681447027,cozytvarchive,11037,,StewPeters LIVE: FALSE FLAG ALERT: Lee Harvey Oswald’s Girlfriend EXPOSES Truth About JFK Assassination & Covid 07/03/2023 • 59 minute stream • 19 peak viewers,2023-07-03 23:11:53+00:00,https://t.me/cozytvarchive/11037,,,193,0,0,0,,,,,,,0,,,1,MessageMediaDocument,0,,,,,video/mp4,4.978731350858138e+18,3557.0,stewpeters-2023-07-03.mp4,,,,,,,,,,,,,,,
msg_iteration.16999.user.cozytvarchive.post.11036,1681447027,cozytvarchive,11036,,Stone ICYMI: Roger Stone and Jack Posobiec Discuss The Indictment and Miami Arraignment of President Trump 07/03/2023 • 56 minute stream • 13 peak viewers,2023-07-03 22:49:48+00:00,https://t.me/cozytvarchive/11036,,,187,0,0,0,,,,,,,0,,,1,MessageMediaDocument,0,,,,,video/mp4,4.978731350858138e+18,3403.0,stone-2023-07-03.mp4,,,,,,,,,,,,,,,
msg_iteration.17000.user.cozytvarchive.post.11035,1681447027,cozytvarchive,11035,,DickMasterson Dick Masterson 07/03/2023 • 1 hour 57 minute stream • 231 peak viewers,2023-07-03 22:43:30+00:00,https://t.me/cozytvarchive/11035,,,180,0,0,0,,,,,,,0,,,1,MessageMediaDocument,0,,,,,video/mp4,4.978731350858138e+18,7059.0,dickmasterson-2023-07-03.mp4,,,,,,,,,,,,,,,
msg_iteration.17001.user.cozytvarchive.post.11034,1681447027,cozytvarchive,11034,,Tenryo PLAN TRUSTERS ONLY!!! HIGH OCTANE GAMING FEATURING YOUR FAVORITE MAGICAL NEGRO WHO HOLDS THE KEYS TO SUCCESS!!! Part 5 of 5,2023-07-03 22:34:32+00:00,https://t.me/cozytvarchive/11034,,,183,0,0,0,,,,,,,0,,,1,MessageMediaDocument,0,,,,,video/mp4,4.978731350858138e+18,10969.0,tenryo-2023-07-03-part-4.mp4,,,,,,,,,,,,,,,
msg_iteration.17002.user.cozytvarchive.post.11033,1681447027,cozytvarchive,11033,,Tenryo PLAN TRUSTERS ONLY!!! HIGH OCTANE GAMING FEATURING YOUR FAVORITE MAGICAL NEGRO WHO HOLDS THE KEYS TO SUCCESS!!! Part 4 of 5,2023-07-03 22:27:20+00:00,https://t.me/cozytvarchive/11033,,,176,0,0,0,,,,,,,0,,,1,MessageMediaDocument,0,,,,,video/mp4,4.978731350858138e+18,11018.0,tenryo-2023-07-03-part-3.mp4,,,,,,,,,,,,,,,
msg_iteration.17003.user.cozytvarchive.post.11032,1681447027,cozytvarchive,11032,,Tenryo PLAN TRUSTERS ONLY!!! HIGH OCTANE GAMING FEATURING YOUR FAVORITE MAGICAL NEGRO WHO HOLDS THE KEYS TO SUCCESS!!! Part 3 of 5,2023-07-03 22:19:23+00:00,https://t.me/cozytvarchive/11032,,,171,0,0,0,,,,,,,0,,,1,MessageMediaDocument,0,,,,,video/mp4,4.978731350858138e+18,11016.0,tenryo-2023-07-03-part-2.mp4,,,,,,,,,,,,,,,
msg_iteration.17004.user.cozytvarchive.post.11031,1681447027,cozytvarchive,11031,,Tenryo PLAN TRUSTERS ONLY!!! HIGH OCTANE GAMING FEATURING YOUR FAVORITE MAGICAL NEGRO WHO HOLDS THE KEYS TO SUCCESS!!! Part 2 of 5,2023-07-03 22:11:45+00:00,https://t.me/cozytvarchive/11031,,,191,0,0,0,,,,,,,0,,,1,MessageMediaDocument,0,,,,,video/mp4,4.978731350858138e+18,11016.0,tenryo-2023-07-03-part-1.mp4,,,,,,,,,,,,,,,
msg_iteration.17005.user.cozytvarchive.post.11030,1681447027,cozytvarchive,11030,,Tenryo PLAN TRUSTERS ONLY!!! HIGH OCTANE GAMING FEATURING YOUR FAVORITE MAGICAL NEGRO WHO HOLDS THE KEYS TO SUCCESS!!! Part 1 of 5 07/03/2023 • 15 hour 17 minute stream • 93 peak viewers,2023-07-03 22:03:59+00:00,https://t.me/cozytvarchive/11030,,,202,0,0,0,,,,,,,0,,,1,MessageMediaDocument,0,,,,,video/mp4,4.978731350858138e+18,11018.0,tenryo-2023-07-03-part-0.mp4,,,,,,,,,,,,,,,
msg_iteration.17006.user.cozytvarchive.post.11029,1681447027,cozytvarchive,11029,,"Boseph GM, Maria! Part 2 of 2",2023-07-03 17:44:20+00:00,https://t.me/cozytvarchive/11029,,,209,0,0,0,,,,,,,0,,,1,MessageMediaDocument,0,,,,,video/mp4,4.978731350858138e+18,11075.0,boseph-2023-07-03-part-1.mp4,,,,,,,,,,,,,,,
msg_iteration.17007.user.cozytvarchive.post.11028,1681447027,cozytvarchive,11028,,"Boseph GM, Maria! Part 1 of 2 07/03/2023 • 6 hour 9 minute stream • 29 peak viewers",2023-07-03 17:37:22+00:00,https://t.me/cozytvarchive/11028,,,206,0,0,0,,,,,,,0,,,1,MessageMediaDocument,0,,,,,video/mp4,4.978731350858138e+18,11094.0,boseph-2023-07-03-part-0.mp4,,,,,,,,,,,,,,,
msg_iteration.17008.user.cozytvarchive.post.11027,1681447027,cozytvarchive,11027,,JLP 7/03/23 Mon. The Jesse Lee Peterson Show | 888-77-JESSE 07/03/2023 • 3 hour 28 minute stream • 41 peak viewers,2023-07-03 16:18:28+00:00,https://t.me/cozytvarchive/11027,,,227,0,0,0,,,,,,,0,,,1,MessageMediaDocument,0,,,,,video/mp4,4.976479551044452e+18,11611.0,jlp-2023-07-03.mp4,,,,,,,,,,,,,,,
msg_iteration.17009.user.cozytvarchive.post.11026,1681447027,cozytvarchive,11026,,CrossTalkNews BIBLE STUDY: Acts 19 & Psalm 16 07/03/2023 • 1 hour 54 minute stream • 32 peak viewers,2023-07-03 13:47:51+00:00,https://t.me/cozytvarchive/11026,,,242,0,0,0,,,,,,,0,,,1,MessageMediaDocument,0,,,,,video/mp4,4.976479551044452e+18,6845.0,crosstalknews-2023-07-03.mp4,,,,,,,,,,,,,,,
msg_iteration.17010.user.cozytvarchive.post.11025,1681447027,cozytvarchive,11025,,PaulTown PTH 265: 🤓 🤓 🤓 07/03/2023 • 3 hour 18 minute stream • 126 peak viewers,2023-07-03 10:28:19+00:00,https://t.me/cozytvarchive/11025,,,417,0,2,0,,,,,,,0,,,1,MessageMediaDocument,0,,,,,video/mp4,4.976479551044452e+18,11913.0,paultown-2023-07-03_1.mp4,,,,,,,,,,,,,,,
msg_iteration.17011.user.cozytvarchive.post.11024,1681447027,cozytvarchive,11024,,PaulTown PTH 265: 🤓 🤓 🤓 07/03/2023 • 50 minute stream • 93 peak viewers,2023-07-03 06:45:10+00:00,https://t.me/cozytvarchive/11024,,,397,0,2,0,,,,,,,0,,,1,MessageMediaDocument,0,,,,,video/mp4,4.976479551044452e+18,3012.0,paultown-2023-07-03.mp4,,,,,,,,,,,,,,,
msg_iteration.17012.user.cozytvarchive.post.11023,1681447027,cozytvarchive,11023,,BigTech TOTAL VICTORY POST DEBATE GLOAT STREAM 07/02/2023 • 1 hour 25 minute stream • 374 peak viewers,2023-07-03 06:39:52+00:00,https://t.me/cozytvarchive/11023,,,367,0,1,0,,,,,,,0,,,1,MessageMediaDocument,0,,,,,video/mp4,4.976479551044452e+18,5101.0,bigtech-2023-07-03.mp4,,,,,,,,,,,,,,,
msg_iteration.17013.user.cozytvarchive.post.11022,1681447027,cozytvarchive,11022,,KingKnub Kingknub Stream 07/02/2023 • 1 hour 35 minute stream • 42 peak viewers,2023-07-03 05:23:18+00:00,https://t.me/cozytvarchive/11022,,,325,0,1,0,,,,,,,0,,,1,MessageMediaDocument,0,,,,,video/mp4,4.976479551044452e+18,5749.0,kingknub-2023-07-03.mp4,,,,,,,,,,,,,,,
msg_iteration.17014.user.cozytvarchive.post.11021,1681447027,cozytvarchive,11021,,PoliticallyProvoked Sniping BT & Adam Green vs The Thorpes on if Jesus was real 07/02/2023 • 3 hour 59 minute stream • 702 peak viewers,2023-07-03 04:40:54+00:00,https://t.me/cozytvarchive/11021,,,264,0,2,0,,,,,,,0,,,1,MessageMediaDocument,0,,,,,video/mp4,4.976479551044452e+18,14395.0,politicallyprovoked-2023-07-03.mp4,,,,,,,,,,,,,,,
msg_iteration.17015.user.cozytvarchive.post.11020,1681447027,cozytvarchive,11020,,LPoriginalG You Can't Stop Progress 307 07/02/2023 • 2 hour 22 minute stream • 81 peak viewers,2023-07-03 03:33:02+00:00,https://t.me/cozytvarchive/11020,,,271,0,0,0,,,,,,,0,,,1,MessageMediaDocument,0,,,,,video/mp4,4.976479551044452e+18,8526.0,lporiginalg-2023-07-03.mp4,,,,,,,,,,,,,,,
msg_iteration.17016.user.cozytvarchive.post.11019,1681447027,cozytvarchive,11019,,ClassicalTheist On the Most Holy Trinity: Part III of Walking through the Mysteries of the Catholic Faith 07/02/2023 • 2 hour 14 minute stream • 100 peak viewers,2023-07-03 03:03:57+00:00,https://t.me/cozytvarchive/11019,,,292,0,6,0,,,,,,,0,,,1,MessageMediaDocument,0,,,,,video/mp4,4.976479551044452e+18,8051.0,classicaltheist-2023-07-03.mp4,,,,,,,,,,,,,,,
msg_iteration.17017.user.cozytvarchive.post.11018,1681447027,cozytvarchive,11018,,Wurzelroot WURSE WURLD: WRSWRLD: SUnday IS THE DAY FOR EPIC CONTENT! WURZ STREAMS AND MARHES ON! CLICK HERE TO VIEW 🤠🤡🤒👽 07/02/2023 • 4 hour 18 minute stream • 573 peak viewers,2023-07-03 02:02:32+00:00,https://t.me/cozytvarchive/11018,,,303,0,6,0,,,,,,,0,,,1,MessageMediaDocument,0,,,,,video/mp4,4.976479551044452e+18,15493.0,wurzelroot-2023-07-03.mp4,,,,,,,,,,,,,,,
msg_iteration.17018.user.cozytvarchive.post.11017,1681447027,cozytvarchive,11017,,Speckzo The Emasculation of Men | Pray and Prepare | Episode #9 07/02/2023 • 1 hour 13 minute stream • 72 peak viewers,2023-07-02 21:47:05+00:00,https://t.me/cozytvarchive/11017,,,262,0,1,0,,,,,,,0,,,1,MessageMediaDocument,0,,,,,video/mp4,4.974227751230768e+18,4438.0,speckzo-2023-07-02.mp4,,,,,,,,,,,,,,,
msg_iteration.17019.user.cozytvarchive.post.11016,1681447027,cozytvarchive,11016,,JLP Fellowship with JLP | Church 7/2/23 06/30/2023 • 44 hour 25 minute stream • 17 peak viewers,2023-07-02 19:57:47+00:00,https://t.me/cozytvarchive/11016,,,257,0,0,0,,,,,,,0,,,1,MessageMediaDocument,0,,,,,video/mp4,4.974227751230768e+18,6541.0,jlp-2023-07-02.mp4,,,,,,,,,,,,,,,
msg_iteration.17020.user.cozytvarchive.post.11015,1681447027,cozytvarchive,11015,,Boseph Gm Maria! (Charity Sunday) Part 2 of 2,2023-07-02 17:33:43+00:00,https://t.me/cozytvarchive/11015,,,258,0,0,0,,,,,,,0,,,1,MessageMediaDocument,0,,,,,video/mp4,4.976480246829155e+18,9097.0,boseph-2023-07-02-part-1.mp4,,,,,,,,,,,,,,,
msg_iteration.17021.user.cozytvarchive.post.11014,1681447027,cozytvarchive,11014,,Boseph Gm Maria! (Charity Sunday) Part 1 of 2 07/02/2023 • 5 hour 3 minute stream • 45 peak viewers,2023-07-02 17:28:14+00:00,https://t.me/cozytvarchive/11014,,,247,0,0,0,,,,,,,0,,,1,MessageMediaDocument,0,,,,,video/mp4,4.976480246829155e+18,9116.0,boseph-2023-07-02-part-0.mp4,,,,,,,,,,,,,,,
msg_iteration.17022.user.cozytvarchive.post.11013,1681447027,cozytvarchive,11013,,BigTech Saturday Night Good Stream (no blasphemy) Part 2 of 2,2023-07-02 09:43:32+00:00,https://t.me/cozytvarchive/11013,,,371,0,2,0,,,,,,,0,,,1,MessageMediaDocument,0,,,,,video/mp4,4.97422844701547e+18,10159.0,bigtech-2023-07-02-part-1.mp4,,,,,,,,,,,,,,,
msg_iteration.17023.user.cozytvarchive.post.11012,1681447027,cozytvarchive,11012,,BigTech Saturday Night Good Stream (no blasphemy) Part 1 of 2 07/01/2023 • 5 hour 39 minute stream • 336 peak viewers,2023-07-02 09:36:25+00:00,https://t.me/cozytvarchive/11012,,,367,0,1,0,,,,,,,0,,,1,MessageMediaDocument,0,,,,,video/mp4,4.97422844701547e+18,10180.0,bigtech-2023-07-02-part-0.mp4,,,,,,,,,,,,,,,
msg_iteration.17024.user.cozytvarchive.post.11011,1681447027,cozytvarchive,11011,,"Loulz 🌴𝑀𝒾𝒶𝓂𝒾 𝓌𝒾𝓉𝒽 𝒴𝒪𝐵𝒜, 𝒫𝒶𝓉𝓇𝒾𝑜𝓉 𝒥, 𝒶𝓃𝒹 𝒞𝓇𝒾𝓂𝑒𝓈𝓀𝒾🌴 Part 2 of 2",2023-07-02 07:46:31+00:00,https://t.me/cozytvarchive/11011,,,257,0,1,0,,,,,,,0,,,1,MessageMediaDocument,0,,,,,video/mp4,4.97422844701547e+18,8071.0,loulz-2023-07-02-part-1.mp4,,,,,,,,,,,,,,,
msg_iteration.17025.user.cozytvarchive.post.11010,1681447027,cozytvarchive,11010,,"Loulz 🌴𝑀𝒾𝒶𝓂𝒾 𝓌𝒾𝓉𝒽 𝒴𝒪𝐵𝒜, 𝒫𝒶𝓉𝓇𝒾𝑜𝓉 𝒥, 𝒶𝓃𝒹 𝒞𝓇𝒾𝓂𝑒𝓈𝓀𝒾🌴 Part 1 of 2 07/01/2023 • 4 hour 29 minute stream • 75 peak viewers",2023-07-02 07:39:42+00:00,https://t.me/cozytvarchive/11010,,,258,0,1,0,,,,,,,0,,,1,MessageMediaDocument,0,,,,,video/mp4,4.97422844701547e+18,8093.0,loulz-2023-07-02-part-0.mp4,,,,,,,,,,,,,,,
msg_iteration.17026.user.cozytvarchive.post.11009,1681447027,cozytvarchive,11009,,PaulTown PTH 263: 🤓TWITTER LIMITS VIEWS 🤓 COLLEGE LOANS STILL WEIGHING HEAVY 🤓DISCORD MEMES 🤓 FRENCH RIOTS 🤓 Part 2 of 2,2023-07-02 07:19:24+00:00,https://t.me/cozytvarchive/11009,,,278,0,1,0,,,,,,,0,,,1,MessageMediaDocument,0,,,,,video/mp4,4.97422844701547e+18,9101.0,paultown-2023-07-02-part-1.mp4,,,,,,,,,,,,,,,
msg_iteration.17027.user.cozytvarchive.post.11008,1681447027,cozytvarchive,11008,,PaulTown PTH 263: 🤓TWITTER LIMITS VIEWS 🤓 COLLEGE LOANS STILL WEIGHING HEAVY 🤓DISCORD MEMES 🤓 FRENCH RIOTS 🤓 Part 1 of 2 07/01/2023 • 5 hour 3 minute stream • 278 peak viewers,2023-07-02 07:09:26+00:00,https://t.me/cozytvarchive/11008,,,282,0,1,0,,,,,,,0,,,1,MessageMediaDocument,0,,,,,video/mp4,4.97422844701547e+18,9121.0,paultown-2023-07-02-part-0.mp4,,,,,,,,,,,,,,,
msg_iteration.17028.user.cozytvarchive.post.11007,1681447027,cozytvarchive,11007,,TRSartor 6 DAYS IN FALLUJAH 07/01/2023 • 2 hour 52 minute stream • 25 peak viewers,2023-07-02 03:55:10+00:00,https://t.me/cozytvarchive/11007,,,281,0,1,0,,,,,,,0,,,1,MessageMediaDocument,0,,,,,video/mp4,4.97422844701547e+18,10369.0,trsartor-2023-07-02.mp4,,,,,,,,,,,,,,,
msg_iteration.17029.user.cozytvarchive.post.11006,1681447027,cozytvarchive,11006,,JoeTheBoomer The Dirty Bastard Live with Joe The Boomer Part 3 of 3,2023-07-02 01:37:46+00:00,https://t.me/cozytvarchive/11006,,,256,0,0,0,,,,,,,0,,,1,MessageMediaDocument,0,,,,,video/mp4,4.97422844701547e+18,10667.0,joetheboomer-2023-07-02-part-2.mp4,,,,,,,,,,,,,,,
msg_iteration.17030.user.cozytvarchive.post.11005,1681447027,cozytvarchive,11005,,JoeTheBoomer The Dirty Bastard Live with Joe The Boomer Part 2 of 3,2023-07-02 01:28:42+00:00,https://t.me/cozytvarchive/11005,,,260,0,0,0,,,,,,,0,,,1,MessageMediaDocument,0,,,,,video/mp4,4.97422844701547e+18,10700.0,joetheboomer-2023-07-02-part-1.mp4,,,,,,,,,,,,,,,
msg_iteration.17031.user.cozytvarchive.post.11004,1681447027,cozytvarchive,11004,,JoeTheBoomer The Dirty Bastard Live with Joe The Boomer Part 1 of 3 07/01/2023 • 8 hour 54 minute stream • 87 peak viewers,2023-07-02 01:19:35+00:00,https://t.me/cozytvarchive/11004,,,252,0,0,0,,,,,,,0,,,1,MessageMediaDocument,0,,,,,video/mp4,4.97422844701547e+18,10700.0,joetheboomer-2023-07-02-part-0.mp4,,,,,,,,,,,,,,,
msg_iteration.17032.user.cozytvarchive.post.11003,1681447027,cozytvarchive,11003,,"Wurzelroot WURSE WURLD: WRSWRLD: EPIC STREAM YOU WILL NOT BELIEVE IT, STUDIES SAY THIS STREAM IS TOO EPIC TO VIEW! CLIK HERE TO SEE 07/01/2023 • 3 hour 19 minute stream • 583 peak viewers",2023-07-02 00:32:33+00:00,https://t.me/cozytvarchive/11003,,,270,0,7,0,,,,,,,0,,,1,MessageMediaDocument,0,,,,,video/mp4,4.97422844701547e+18,11964.0,wurzelroot-2023-07-02.mp4,,,,,,,,,,,,,,,
msg_iteration.17033.user.cozytvarchive.post.11002,1681447027,cozytvarchive,11002,,JimboZoomer JIMBO ZOOMER EXPERIENCE😍#1 REACTION STREAMER💥#1 ADHD GLAZER 🤯#1 NEWS SOURCE BROADCAST😲SOME SAY THE NEW SEAN HANNITY Part 2 of 2,2023-07-01 23:07:49+00:00,https://t.me/cozytvarchive/11002,,,246,0,0,0,,,,,,,0,,,1,MessageMediaDocument,0,,,,,video/mp4,4.97422844701547e+18,10936.0,jimbozoomer-2023-07-01-part-1.mp4,,,,,,,,,,,,,,,
msg_iteration.17034.user.cozytvarchive.post.11001,1681447027,cozytvarchive,11001,,JimboZoomer JIMBO ZOOMER EXPERIENCE😍#1 REACTION STREAMER💥#1 ADHD GLAZER 🤯#1 NEWS SOURCE BROADCAST😲SOME SAY THE NEW SEAN HANNITY Part 1 of 2 07/01/2023 • 6 hour 4 minute stream • 162 peak viewers,2023-07-01 23:01:09+00:00,https://t.me/cozytvarchive/11001,,,247,0,0,0,,,,,,,0,,,1,MessageMediaDocument,0,,,,,video/mp4,4.97422844701547e+18,10955.0,jimbozoomer-2023-07-01-part-0.mp4,,,,,,,,,,,,,,,
msg_iteration.17035.user.cozytvarchive.post.11000,1681447027,cozytvarchive,11000,,Boseph Gm! Mwah Part 2 of 2,2023-07-01 16:47:32+00:00,https://t.me/cozytvarchive/11000,,,243,0,0,0,,,,,,,0,,,1,MessageMediaDocument,0,,,,,video/mp4,4.971976647201785e+18,9202.0,boseph-2023-07-01-part-1.mp4,,,,,,,,,,,,,,,
msg_iteration.17036.user.cozytvarchive.post.10999,1681447027,cozytvarchive,10999,,Boseph Gm! Mwah Part 1 of 2 07/01/2023 • 5 hour 7 minute stream • 32 peak viewers,2023-07-01 16:41:55+00:00,https://t.me/cozytvarchive/10999,,,265,0,0,0,,,,,,,0,,,1,MessageMediaDocument,0,,,,,video/mp4,4.971976647201785e+18,9224.0,boseph-2023-07-01-part-0.mp4,,,,,,,,,,,,,,,
msg_iteration.17037.user.cozytvarchive.post.10998,1681447027,cozytvarchive,10998,,Beardson late show omegle 07/01/2023 • 2 hour 58 minute stream • 231 peak viewers,2023-07-01 10:38:14+00:00,https://t.me/cozytvarchive/10998,,,271,0,1,0,,,,,,,0,,,1,MessageMediaDocument,0,,,,,video/mp4,4.971976647201785e+18,10690.0,beardson-2023-07-01_1.mp4,,,,,,,,,,,,,,,
msg_iteration.17038.user.cozytvarchive.post.10997,1681447027,cozytvarchive,10997,,PaulTown PTH 263: 🤓 FRENCH RIOTS KINO 🤓 COLLEGE LOANS STILL WEIGHING HEAVY 🤓DISCORD MEME CONTENTMANIA 🤓 Part 2 of 2,2023-07-01 09:48:50+00:00,https://t.me/cozytvarchive/10997,,,413,0,3,0,,,,,,,0,,,1,MessageMediaDocument,0,,,,,video/mp4,4.971976647201785e+18,11354.0,paultown-2023-07-01-part-1.mp4,,,,,,,,,,,,,,,
msg_iteration.17039.user.cozytvarchive.post.10996,1681447027,cozytvarchive,10996,,PaulTown PTH 263: 🤓 FRENCH RIOTS KINO 🤓 COLLEGE LOANS STILL WEIGHING HEAVY 🤓DISCORD MEME CONTENTMANIA 🤓 Part 1 of 2 06/30/2023 • 6 hour 18 minute stream • 373 peak viewers,2023-07-01 09:37:40+00:00,https://t.me/cozytvarchive/10996,,,403,0,3,0,,,,,,,0,,,1,MessageMediaDocument,0,,,,,video/mp4,4.971976647201785e+18,11373.0,paultown-2023-07-01-part-0.mp4,,,,,,,,,,,,,,,
msg_iteration.17040.user.cozytvarchive.post.10995,1681447027,cozytvarchive,10995,,"PoliticallyProvoked Ultros takes RPG to court, More Thorpes, Incest, Scientology 07/01/2023 • 1 hour 6 minute stream • 68 peak viewers",2023-07-01 08:48:59+00:00,https://t.me/cozytvarchive/10995,,,261,0,0,0,,,,,,,0,,,1,MessageMediaDocument,0,,,,,video/mp4,4.971976647201785e+18,4000.0,politicallyprovoked-2023-07-01_2.mp4,,,,,,,,,,,,,,,
msg_iteration.17041.user.cozytvarchive.post.10994,1681447027,cozytvarchive,10994,,"Nick FRENCH REVOLUTION IMMINENT??? Migrant Savages RIOT After Police Shooting | America First Ep. 1185 07/01/2023 • 2 hour 16 minute stream • 5,535 peak viewers",2023-07-01 07:34:43+00:00,https://t.me/cozytvarchive/10994,,,245,0,1,0,,,,,,,0,,,1,MessageMediaDocument,0,,,,,video/mp4,4.971976647201785e+18,8188.0,nick-2023-07-01.mp4,,,,,,,,,,,,,,,
msg_iteration.17042.user.cozytvarchive.post.10993,1681447027,cozytvarchive,10993,,"PoliticallyProvoked Ultros takes RPG to court, More Thorpes, Incest, Scientology 06/30/2023 • 2 hour 57 minute stream • 413 peak viewers",2023-07-01 05:43:03+00:00,https://t.me/cozytvarchive/10993,,,229,0,0,0,,,,,,,0,,,1,MessageMediaDocument,0,,,,,video/mp4,4.972524732273394e+18,10632.0,politicallyprovoked-2023-07-01_1.mp4,,,,,,,,,,,,,,,
msg_iteration.17043.user.cozytvarchive.post.10992,1681447027,cozytvarchive,10992,,Loulz 🍻 𝑀𝑜𝓊𝓃𝓉𝒶𝒾𝓃 𝒟𝑒𝓌 𝐵𝑒𝑒𝓇𝓈 𝒶𝓉 𝓉𝒽𝑒 𝒜𝐼𝑅𝐵𝒩𝐵 𝓌𝒾𝓉𝒽 𝒞𝓇𝒾𝓂𝑒𝓈𝓀𝒾 𝒶𝓃𝒹 𝒫𝒶𝓉𝓇𝒾𝑜𝓉 𝒥 🍻 06/30/2023 • 2 hour 22 minute stream • 463 peak viewers,2023-07-01 05:08:47+00:00,https://t.me/cozytvarchive/10992,,,234,0,2,0,,,,,,,0,,,1,MessageMediaDocument,0,,,,,video/mp4,4.972524732273394e+18,8565.0,loulz-2023-07-01.mp4,,,,,,,,,,,,,,,
msg_iteration.17044.user.cozytvarchive.post.10991,1681447027,cozytvarchive,10991,,TRSartor NO QUEERS ALLOWED 06/30/2023 • 1 hour 52 minute stream • 45 peak viewers,2023-07-01 04:13:09+00:00,https://t.me/cozytvarchive/10991,,,268,0,3,0,,,,,,,0,,,1,MessageMediaDocument,0,,,,,video/mp4,4.972524732273394e+18,6730.0,trsartor-2023-07-01_2.mp4,,,,,,,,,,,,,,,
msg_iteration.17045.user.cozytvarchive.post.10990,1681447027,cozytvarchive,10990,,LPoriginalG You Can't Stop Progress (June Highlights) 06/30/2023 • 2 hour 54 minute stream • 34 peak viewers,2023-07-01 04:02:29+00:00,https://t.me/cozytvarchive/10990,,,265,0,0,0,,,,,,,0,,,1,MessageMediaDocument,0,,,,,video/mp4,4.972524732273394e+18,10454.0,lporiginalg-2023-07-01.mp4,,,,,,,,,,,,,,,
msg_iteration.17046.user.cozytvarchive.post.10989,1681447027,cozytvarchive,10989,,DaltonClodfelter REACTIONARY RADIO: ULTROS TOOK RPG TO COURT??? FDA AND NEURALINK! CRINGE RAP MUSIC! NEW GTA 6 LEAKS ARE INSANE! COCAINE! Part 2 of 2,2023-07-01 03:44:29+00:00,https://t.me/cozytvarchive/10989,,,274,0,5,0,,,,,,,0,,,1,MessageMediaDocument,0,,,,,video/mp4,4.972524732273394e+18,7548.0,daltonclodfelter-2023-07-01-part-1.mp4,,,,,,,,,,,,,,,
msg_iteration.17047.user.cozytvarchive.post.10988,1681447027,cozytvarchive,10988,,DaltonClodfelter REACTIONARY RADIO: ULTROS TOOK RPG TO COURT??? FDA AND NEURALINK! CRINGE RAP MUSIC! NEW GTA 6 LEAKS ARE INSANE! COCAINE! Part 1 of 2 06/30/2023 • 4 hour 11 minute stream • 648 peak viewers,2023-07-01 03:37:06+00:00,https://t.me/cozytvarchive/10988,,,312,0,6,0,,,,,,,0,,,1,MessageMediaDocument,0,,,,,video/mp4,4.972524732273394e+18,7569.0,daltonclodfelter-2023-07-01-part-0.mp4,,,,,,,,,,,,,,,
msg_iteration.17048.user.cozytvarchive.post.10987,1681447027,cozytvarchive,10987,,EthanRalph KILLSTREAM: ALL IN WITH WANG LIN Part 3 of 3,2023-07-01 03:19:48+00:00,https://t.me/cozytvarchive/10987,,,304,0,4,0,,,,,,,0,,,1,MessageMediaDocument,0,,,,,video/mp4,4.972524732273394e+18,11072.0,ethanralph-2023-07-01-part-2.mp4,,,,,,,,,,,,,,,
msg_iteration.17049.user.cozytvarchive.post.10986,1681447027,cozytvarchive,10986,,EthanRalph KILLSTREAM: ALL IN WITH WANG LIN Part 2 of 3,2023-07-01 03:12:53+00:00,https://t.me/cozytvarchive/10986,,,292,0,4,0,,,,,,,0,,,1,MessageMediaDocument,0,,,,,video/mp4,4.972524732273394e+18,11100.0,ethanralph-2023-07-01-part-1.mp4,,,,,,,,,,,,,,,
msg_iteration.17050.user.cozytvarchive.post.10985,1681447027,cozytvarchive,10985,,EthanRalph KILLSTREAM: ALL IN WITH WANG LIN Part 1 of 3 06/30/2023 • 9 hour 14 minute stream • 646 peak viewers,2023-07-01 03:04:34+00:00,https://t.me/cozytvarchive/10985,,,284,0,4,0,,,,,,,0,,,1,MessageMediaDocument,0,,,,,video/mp4,4.972524732273394e+18,11102.0,ethanralph-2023-07-01-part-0.mp4,,,,,,,,,,,,,,,
msg_iteration.17051.user.cozytvarchive.post.10984,1681447027,cozytvarchive,10984,,TRSartor Gay black dudes are having a rough week 06/30/2023 • 21 minute stream • 13 peak viewers,2023-07-01 02:33:58+00:00,https://t.me/cozytvarchive/10984,,,283,0,2,0,,,,,,,0,,,1,MessageMediaDocument,0,,,,,video/mp4,4.970272932459708e+18,1283.0,trsartor-2023-07-01_1.mp4,,,,,,,,,,,,,,,
msg_iteration.17052.user.cozytvarchive.post.10983,1681447027,cozytvarchive,10983,,wendell foreign policy friday w/anglozoomer 6/30 06/30/2023 • 2 hour 38 minute stream • 140 peak viewers,2023-07-01 02:31:58+00:00,https://t.me/cozytvarchive/10983,,,964,0,5,0,,,,,,,0,,,1,MessageMediaDocument,0,,,,,video/mp4,4.970272932459708e+18,9484.0,wendell-2023-07-01.mp4,,,,,,,,,,,,,,,
msg_iteration.17053.user.cozytvarchive.post.10982,1681447027,cozytvarchive,10982,,TRSartor Gay black dudes are having a rough week 06/30/2023 • stream • 3 peak viewers,2023-07-01 02:18:14+00:00,https://t.me/cozytvarchive/10982,,,219,0,1,0,,,,,,,0,,,1,MessageMediaDocument,0,,,,,video/mp4,4.970272932459708e+18,18.0,trsartor-2023-07-01.mp4,,,,,,,,,,,,,,,
msg_iteration.17054.user.cozytvarchive.post.10981,1681447027,cozytvarchive,10981,,JoeTheBoomer The Dirty Bastard Live with Joe The Boomer Part 3 of 3,2023-07-01 02:17:45+00:00,https://t.me/cozytvarchive/10981,,,201,0,0,0,,,,,,,0,,,1,MessageMediaDocument,0,,,,,video/mp4,4.970272932459708e+18,11930.0,joetheboomer-2023-07-01-part-2.mp4,,,,,,,,,,,,,,,
msg_iteration.17055.user.cozytvarchive.post.10980,1681447027,cozytvarchive,10980,,JoeTheBoomer The Dirty Bastard Live with Joe The Boomer Part 2 of 3,2023-07-01 02:07:18+00:00,https://t.me/cozytvarchive/10980,,,194,0,0,0,,,,,,,0,,,1,MessageMediaDocument,0,,,,,video/mp4,4.970272932459708e+18,11967.0,joetheboomer-2023-07-01-part-1.mp4,,,,,,,,,,,,,,,
msg_iteration.17056.user.cozytvarchive.post.10979,1681447027,cozytvarchive,10979,,JoeTheBoomer The Dirty Bastard Live with Joe The Boomer Part 1 of 3 06/30/2023 • 9 hour 57 minute stream • 24 peak viewers,2023-07-01 01:56:43+00:00,https://t.me/cozytvarchive/10979,,,186,0,0,0,,,,,,,0,,,1,MessageMediaDocument,0,,,,,video/mp4,4.970272932459708e+18,11966.0,joetheboomer-2023-07-01-part-0.mp4,,,,,,,,,,,,,,,
msg_iteration.17057.user.cozytvarchive.post.10978,1681447027,cozytvarchive,10978,,Beardson Bad News #7: Its All Bad 06/30/2023 • 2 hour 39 minute stream • 635 peak viewers,2023-07-01 00:47:56+00:00,https://t.me/cozytvarchive/10978,,,208,0,5,0,,,,,,,0,,,1,MessageMediaDocument,0,,,,,video/mp4,4.970272932459708e+18,9561.0,beardson-2023-07-01.mp4,,,,,,,,,,,,,,,
msg_iteration.17058.user.cozytvarchive.post.10977,1681447027,cozytvarchive,10977,,"PoliticallyProvoked Ultros takes RPG to court, More Thorpes, Incest, Scientology 06/30/2023 • 59 minute stream • 70 peak viewers",2023-07-01 00:17:02+00:00,https://t.me/cozytvarchive/10977,,,211,0,1,0,,,,,,,0,,,1,MessageMediaDocument,0,,,,,video/mp4,4.970272932459708e+18,3566.0,politicallyprovoked-2023-07-01.mp4,,,,,,,,,,,,,,,
msg_iteration.17059.user.cozytvarchive.post.10976,1681447027,cozytvarchive,10976,,JimboZoomer JIMBO ZOOMER EXPERIENCE😍#1 REACTION STREAMER💥#1 ADHD GLAZER 🤯#1 NEWS SOURCE BROADCAST😲SOME SAY THE NEW SEAN HANNITY Part 2 of 2,2023-06-30 23:54:50+00:00,https://t.me/cozytvarchive/10976,,,206,0,0,0,,,,,,,0,,,1,MessageMediaDocument,0,,,,,video/mp4,4.970272932459708e+18,11498.0,jimbozoomer-2023-06-30-part-1.mp4,,,,,,,,,,,,,,,
msg_iteration.17060.user.cozytvarchive.post.10975,1681447027,cozytvarchive,10975,,JimboZoomer JIMBO ZOOMER EXPERIENCE😍#1 REACTION STREAMER💥#1 ADHD GLAZER 🤯#1 NEWS SOURCE BROADCAST😲SOME SAY THE NEW SEAN HANNITY Part 1 of 2 06/30/2023 • 6 hour 23 minute stream • 242 peak viewers,2023-06-30 23:47:14+00:00,https://t.me/cozytvarchive/10975,,,176,0,0,0,,,,,,,0,,,1,MessageMediaDocument,0,,,,,video/mp4,4.970272932459708e+18,11518.0,jimbozoomer-2023-06-30-part-0.mp4,,,,,,,,,,,,,,,
msg_iteration.17061.user.cozytvarchive.post.10974,1681447027,cozytvarchive,10974,,"StewPeters LIVE: Never Before Seen VIDEO Interview From J6 GULAG, FEDS Cover-Up J6 Pipe Bomb & Alter DNC Video? 06/30/2023 • 1 hour 1 minute stream • 6 peak viewers",2023-06-30 23:17:48+00:00,https://t.me/cozytvarchive/10974,,,169,0,1,0,,,,,,,0,,,1,MessageMediaDocument,0,,,,,video/mp4,4.970272932459708e+18,3677.0,stewpeters-2023-06-30.mp4,,,,,,,,,,,,,,,
msg_iteration.17062.user.cozytvarchive.post.10973,1681447027,cozytvarchive,10973,,EMichaelJones EMJ Live #31: What Is Hate Speech? 06/30/2023 • 1 hour 41 minute stream • 317 peak viewers,2023-06-30 22:38:39+00:00,https://t.me/cozytvarchive/10973,,,237,0,11,0,,,,,,,0,,,1,MessageMediaDocument,0,,,,,video/mp4,4.970272932459708e+18,6062.0,emichaeljones-2023-06-30.mp4,,,,,,,,,,,,,,,
msg_iteration.17063.user.cozytvarchive.post.10972,1681447027,cozytvarchive,10972,,Stone Will Jack Smith File New Charges Against Trump? Roger Stone w/ Trump Impeachment Lawyer David Schoen 06/30/2023 • 57 minute stream • 5 peak viewers,2023-06-30 22:09:14+00:00,https://t.me/cozytvarchive/10972,,,166,0,1,0,,,,,,,0,,,1,MessageMediaDocument,0,,,,,video/mp4,4.970272932459708e+18,3456.0,stone-2023-06-30.mp4,,,,,,,,,,,,,,,
msg_iteration.17064.user.cozytvarchive.post.10971,1681447027,cozytvarchive,10971,,PatrickHowley Geraldo's Shocking Past Exposed | The Campaign Show 06/30/2023 • 38 minute stream • 21 peak viewers,2023-06-30 21:45:59+00:00,https://t.me/cozytvarchive/10971,,,170,0,1,0,,,,,,,0,,,1,MessageMediaDocument,0,,,,,video/mp4,4.970272932459708e+18,2295.0,patrickhowley-2023-06-30.mp4,,,,,,,,,,,,,,,
msg_iteration.17065.user.cozytvarchive.post.10969,1681447027,cozytvarchive,10969,,JLP CBOW & SNAPPA Join Jesse! (#317) 06/30/2023 • 1 hour 17 minute stream • 8 peak viewers,2023-06-30 20:27:08+00:00,https://t.me/cozytvarchive/10969,,,162,0,1,0,,,,,,,0,,,1,MessageMediaDocument,0,,,,,video/mp4,4.970272932459708e+18,4585.0,jlp-2023-06-30_2.mp4,,,,,,,,,,,,,,,
msg_iteration.17066.user.cozytvarchive.post.10968,1681447027,cozytvarchive,10968,,JLP CBOW & SNAPPA Join Jesse! (#317) 06/30/2023 • 12 minute stream • 4 peak viewers,2023-06-30 19:12:02+00:00,https://t.me/cozytvarchive/10968,,,165,0,0,0,,,,,,,0,,,1,MessageMediaDocument,0,,,,,video/mp4,4.970272932459708e+18,743.0,jlp-2023-06-30_1.mp4,,,,,,,,,,,,,,,
msg_iteration.17067.user.cozytvarchive.post.10967,1681447027,cozytvarchive,10967,,Boseph Gm! Mwah Part 2 of 2,2023-06-30 16:54:21+00:00,https://t.me/cozytvarchive/10967,,,173,0,0,0,,,,,,,0,,,1,MessageMediaDocument,0,,,,,video/mp4,4.970272932459708e+18,9134.0,boseph-2023-06-30-part-1.mp4,,,,,,,,,,,,,,,
msg_iteration.17068.user.cozytvarchive.post.10966,1681447027,cozytvarchive,10966,,Boseph Gm! Mwah Part 1 of 2 06/30/2023 • 5 hour 4 minute stream • 32 peak viewers,2023-06-30 16:48:21+00:00,https://t.me/cozytvarchive/10966,,,171,0,0,0,,,,,,,0,,,1,MessageMediaDocument,0,,,,,video/mp4,4.970272932459708e+18,9156.0,boseph-2023-06-30-part-0.mp4,,,,,,,,,,,,,,,
msg_iteration.17069.user.cozytvarchive.post.10965,1681447027,cozytvarchive,10965,,JLP 6/30/23 Fri. The Jesse Lee Peterson Show | 888-77-JESSE 06/30/2023 • 3 hour 27 minute stream • 39 peak viewers,2023-06-30 16:26:32+00:00,https://t.me/cozytvarchive/10965,,,169,0,1,0,,,,,,,0,,,1,MessageMediaDocument,0,,,,,video/mp4,4.970272932459708e+18,12040.0,jlp-2023-06-30.mp4,,,,,,,,,,,,,,,
msg_iteration.17070.user.cozytvarchive.post.10964,1681447027,cozytvarchive,10964,,CrossTalkNews BIBLE STUDY & LIVE HYMNS: Acts 18 & Psalm 15 | From The EMB Arcade 06/30/2023 • 1 hour 39 minute stream • 29 peak viewers,2023-06-30 13:54:31+00:00,https://t.me/cozytvarchive/10964,,,179,0,1,0,,,,,,,0,,,1,MessageMediaDocument,0,,,,,video/mp4,4.970272932459708e+18,5973.0,crosstalknews-2023-06-30.mp4,,,,,,,,,,,,,,,
msg_iteration.17071.user.cozytvarchive.post.10963,1681447027,cozytvarchive,10963,,Tenryo The Frenryo Hour - Getting Fired Edition Part 2 of 2,2023-06-30 13:44:26+00:00,https://t.me/cozytvarchive/10963,,,178,0,0,0,,,,,,,0,,,1,MessageMediaDocument,0,,,,,video/mp4,4.970272932459708e+18,10538.0,tenryo-2023-06-30-part-1.mp4,,,,,,,,,,,,,,,
msg_iteration.17072.user.cozytvarchive.post.10962,1681447027,cozytvarchive,10962,,Tenryo The Frenryo Hour - Getting Fired Edition Part 1 of 2 06/30/2023 • 5 hour 51 minute stream • 61 peak viewers,2023-06-30 13:36:16+00:00,https://t.me/cozytvarchive/10962,,,182,0,0,0,,,,,,,0,,,1,MessageMediaDocument,0,,,,,video/mp4,4.970272932459708e+18,10558.0,tenryo-2023-06-30-part-0.mp4,,,,,,,,,,,,,,,
msg_iteration.17073.user.cozytvarchive.post.10961,1681447027,cozytvarchive,10961,,JoelDavis LIVE: the Joel & Blair Show 06/30/2023 • 1 hour 41 minute stream • 69 peak viewers,2023-06-30 12:16:47+00:00,https://t.me/cozytvarchive/10961,,,759,0,3,0,,,,,,,0,,,1,MessageMediaDocument,0,,,,,video/mp4,4.970272932459708e+18,6112.0,joeldavis-2023-06-30.mp4,,,,,,,,,,,,,,,
msg_iteration.17074.user.cozytvarchive.post.10960,1681447027,cozytvarchive,10960,,BigTech Demonic Jewish Late Show Part 2 of 2,2023-06-30 11:29:56+00:00,https://t.me/cozytvarchive/10960,,,306,0,2,0,,,,,,,0,,,1,MessageMediaDocument,0,,,,,video/mp4,4.970272932459708e+18,7143.0,bigtech-2023-06-30-part-1.mp4,,,,,,,,,,,,,,,
msg_iteration.17075.user.cozytvarchive.post.10959,1681447027,cozytvarchive,10959,,BigTech Demonic Jewish Late Show Part 1 of 2 06/30/2023 • 3 hour 58 minute stream • 354 peak viewers,2023-06-30 11:24:15+00:00,https://t.me/cozytvarchive/10959,,,290,0,2,0,,,,,,,0,,,1,MessageMediaDocument,0,,,,,video/mp4,4.970272932459708e+18,7162.0,bigtech-2023-06-30-part-0.mp4,,,,,,,,,,,,,,,
msg_iteration.17076.user.cozytvarchive.post.10958,1681447027,cozytvarchive,10958,,Beardson late show 06/30/2023 • 1 hour 47 minute stream • 237 peak viewers,2023-06-30 09:08:11+00:00,https://t.me/cozytvarchive/10958,,,174,0,2,0,,,,,,,0,,,1,MessageMediaDocument,0,,,,,video/mp4,4.970272932459708e+18,6438.0,beardson-2023-06-30.mp4,,,,,,,,,,,,,,,
msg_iteration.17077.user.cozytvarchive.post.10957,1681447027,cozytvarchive,10957,,TylerRussell THE LAST OF US 06/30/2023 • 47 minute stream • 28 peak viewers,2023-06-30 09:00:03+00:00,https://t.me/cozytvarchive/10957,,,179,0,0,0,,,,,,,0,,,1,MessageMediaDocument,0,,,,,video/mp4,4.970272932459708e+18,2871.0,tylerrussell-2023-06-30.mp4,,,,,,,,,,,,,,,
msg_iteration.17078.user.cozytvarchive.post.10956,1681447027,cozytvarchive,10956,,"Nick AFFIRMATIVE ACTION IS OVER: Supreme Court Votes 6-3 To END Harvard Admissions Policy | America First Ep. 1184 06/30/2023 • 2 hour 12 minute stream • 5,923 peak viewers",2023-06-30 08:55:27+00:00,https://t.me/cozytvarchive/10956,,,181,0,1,0,,,,,,,0,,,1,MessageMediaDocument,0,,,,,video/mp4,4.970272932459708e+18,7944.0,nick-2023-06-30.mp4,,,,,,,,,,,,,,,
msg_iteration.17079.user.cozytvarchive.post.10952,1681447027,cozytvarchive,10952,,PoliticallyProvoked EVERYTHING SUCKS SO WE'RE JOINING SCIENTOLOGY 06/29/2023 • 4 hour 14 minute stream • 201 peak viewers,2023-06-30 05:36:24+00:00,https://t.me/cozytvarchive/10952,,,188,0,0,0,,,,,,,0,,,1,MessageMediaDocument,0,,,,,video/mp4,4.970136472758781e+18,15249.0,politicallyprovoked-2023-06-30.mp4,,,,,,,,,,,,,,,
msg_iteration.17080.user.cozytvarchive.post.10951,1681447027,cozytvarchive,10951,,EthanRalph KILLSTREAM: LIVE FROM LAS VEGAS Part 3 of 3,2023-06-30 03:14:25+00:00,https://t.me/cozytvarchive/10951,,,185,0,0,0,,,,,,,0,,,1,MessageMediaDocument,0,,,,,video/mp4,4.970136472758781e+18,11069.0,ethanralph-2023-06-30-part-2.mp4,,,,,,,,,,,,,,,
msg_iteration.17081.user.cozytvarchive.post.10950,1681447027,cozytvarchive,10950,,EthanRalph KILLSTREAM: LIVE FROM LAS VEGAS Part 2 of 3,2023-06-30 03:08:08+00:00,https://t.me/cozytvarchive/10950,,,187,0,0,0,,,,,,,0,,,1,MessageMediaDocument,0,,,,,video/mp4,4.970136472758781e+18,11098.0,ethanralph-2023-06-30-part-1.mp4,,,,,,,,,,,,,,,
msg_iteration.17082.user.cozytvarchive.post.10949,1681447027,cozytvarchive,10949,,EthanRalph KILLSTREAM: LIVE FROM LAS VEGAS Part 1 of 3 06/29/2023 • 9 hour 14 minute stream • 507 peak viewers,2023-06-30 03:01:45+00:00,https://t.me/cozytvarchive/10949,,,196,0,0,0,,,,,,,0,,,1,MessageMediaDocument,0,,,,,video/mp4,4.970136472758781e+18,11100.0,ethanralph-2023-06-30-part-0.mp4,,,,,,,,,,,,,,,
msg_iteration.17083.user.cozytvarchive.post.10948,1681447027,cozytvarchive,10948,,wendell book club 36 (america's protectionist takeoff p262+) 06/29/2023 • 2 hour 37 minute stream • 162 peak viewers,2023-06-30 02:29:07+00:00,https://t.me/cozytvarchive/10948,,,956,0,5,0,,,,,,,0,,,1,MessageMediaDocument,0,,,,,video/mp4,4.967884672945096e+18,9431.0,wendell-2023-06-30.mp4,,,,,,,,,,,,,,,
msg_iteration.17084.user.cozytvarchive.post.10947,1681447027,cozytvarchive,10947,,Woozuh Bird museum 06/29/2023 • 1 hour 28 minute stream • 30 peak viewers,2023-06-30 02:16:53+00:00,https://t.me/cozytvarchive/10947,,,180,0,0,0,,,,,,,0,,,1,MessageMediaDocument,0,,,,,video/mp4,4.967884672945096e+18,5310.0,woozuh-2023-06-30.mp4,,,,,,,,,,,,,,,
msg_iteration.17085.user.cozytvarchive.post.10946,1681447027,cozytvarchive,10946,,JoeTheBoomer The Dirty Bastard Live with Joe The Boomer Part 3 of 3,2023-06-30 02:09:37+00:00,https://t.me/cozytvarchive/10946,,,178,0,0,0,,,,,,,0,,,1,MessageMediaDocument,0,,,,,video/mp4,4.967884672945096e+18,12092.0,joetheboomer-2023-06-30-part-2.mp4,,,,,,,,,,,,,,,
msg_iteration.17086.user.cozytvarchive.post.10945,1681447027,cozytvarchive,10945,,JoeTheBoomer The Dirty Bastard Live with Joe The Boomer Part 2 of 3,2023-06-30 02:00:51+00:00,https://t.me/cozytvarchive/10945,,,172,0,0,0,,,,,,,0,,,1,MessageMediaDocument,0,,,,,video/mp4,4.967884672945096e+18,12125.0,joetheboomer-2023-06-30-part-1.mp4,,,,,,,,,,,,,,,
msg_iteration.17087.user.cozytvarchive.post.10944,1681447027,cozytvarchive,10944,,JoeTheBoomer The Dirty Bastard Live with Joe The Boomer Part 1 of 3 06/29/2023 • 10 hour 5 minute stream • 32 peak viewers,2023-06-30 01:52:32+00:00,https://t.me/cozytvarchive/10944,,,176,0,0,0,,,,,,,0,,,1,MessageMediaDocument,0,,,,,video/mp4,4.967884672945096e+18,12125.0,joetheboomer-2023-06-30-part-0.mp4,,,,,,,,,,,,,,,
msg_iteration.17088.user.cozytvarchive.post.10943,1681447027,cozytvarchive,10943,,Woozuh Bird museum 06/29/2023 • 3 hour 57 minute stream • 30 peak viewers,2023-06-30 00:07:18+00:00,https://t.me/cozytvarchive/10943,,,177,0,0,0,,,,,,,0,,,1,MessageMediaDocument,0,,,,,video/mp4,4.967884672945096e+18,14260.0,woozuh-2023-06-29_1.mp4,,,,,,,,,,,,,,,
msg_iteration.17089.user.cozytvarchive.post.10942,1681447027,cozytvarchive,10942,,StewPeters LIVE: Make FAT SHAMING Great Again? DEPOPULATION SHOCK Survey: 25% Of 40-Year-Olds Never Married 06/29/2023 • 54 minute stream • 7 peak viewers,2023-06-29 23:30:33+00:00,https://t.me/cozytvarchive/10942,,,177,0,0,0,,,,,,,0,,,1,MessageMediaDocument,0,,,,,video/mp4,4.967884672945096e+18,3271.0,stewpeters-2023-06-29.mp4,,,,,,,,,,,,,,,
msg_iteration.17090.user.cozytvarchive.post.10941,1681447027,cozytvarchive,10941,,JimboZoomer JIMBO ZOOMER EXPERIENCE😍#1 REACTION STREAMER💥#1 ADHD GLAZER 🤯#1 NEWS SOURCE BROADCAST😲SOME SAY THE NEW SEAN HANNITY Part 2 of 2,2023-06-29 23:25:19+00:00,https://t.me/cozytvarchive/10941,,,175,0,0,0,,,,,,,0,,,1,MessageMediaDocument,0,,,,,video/mp4,4.967884672945096e+18,11403.0,jimbozoomer-2023-06-29-part-1.mp4,,,,,,,,,,,,,,,
msg_iteration.17091.user.cozytvarchive.post.10940,1681447027,cozytvarchive,10940,,JimboZoomer JIMBO ZOOMER EXPERIENCE😍#1 REACTION STREAMER💥#1 ADHD GLAZER 🤯#1 NEWS SOURCE BROADCAST😲SOME SAY THE NEW SEAN HANNITY Part 1 of 2 06/29/2023 • 6 hour 20 minute stream • 749 peak viewers,2023-06-29 23:17:14+00:00,https://t.me/cozytvarchive/10940,,,172,0,0,0,,,,,,,0,,,1,MessageMediaDocument,0,,,,,video/mp4,4.967884672945096e+18,11424.0,jimbozoomer-2023-06-29-part-0.mp4,,,,,,,,,,,,,,,
msg_iteration.17092.user.cozytvarchive.post.10939,1681447027,cozytvarchive,10939,,"Stone Chris Collins on Bidenomics, Woke Agenda & the Dept of Injustice + Joe Hoft: Will They Steal 2024? 06/29/2023 • 58 minute stream • 7 peak viewers",2023-06-29 22:16:50+00:00,https://t.me/cozytvarchive/10939,,,172,0,0,0,,,,,,,0,,,1,MessageMediaDocument,0,,,,,video/mp4,4.967884672945096e+18,3483.0,stone-2023-06-29.mp4,,,,,,,,,,,,,,,
msg_iteration.17093.user.cozytvarchive.post.10938,1681447027,cozytvarchive,10938,,PatrickHowley Anti-White Hatred Rampages As Replacement Migration Destabilizes the World | The Campaign Show 06/29/2023 • 41 minute stream • 28 peak viewers,2023-06-29 21:51:38+00:00,https://t.me/cozytvarchive/10938,,,190,0,1,0,,,,,,,0,,,1,MessageMediaDocument,0,,,,,video/mp4,4.967884672945096e+18,2500.0,patrickhowley-2023-06-29.mp4,,,,,,,,,,,,,,,
msg_iteration.17094.user.cozytvarchive.post.10937,1681447027,cozytvarchive,10937,,Woozuh Bird museum 06/29/2023 • 27 minute stream • 14 peak viewers,2023-06-29 19:48:50+00:00,https://t.me/cozytvarchive/10937,,,188,0,0,0,,,,,,,0,,,1,MessageMediaDocument,0,,,,,video/mp4,4.967884672945096e+18,1668.0,woozuh-2023-06-29.mp4,,,,,,,,,,,,,,,
msg_iteration.17095.user.cozytvarchive.post.10936,1681447027,cozytvarchive,10936,,Boseph Gm! Mwah Part 2 of 2,2023-06-29 16:56:37+00:00,https://t.me/cozytvarchive/10936,,,188,0,0,0,,,,,,,0,,,1,MessageMediaDocument,0,,,,,video/mp4,4.967884672945096e+18,9520.0,boseph-2023-06-29-part-1.mp4,,,,,,,,,,,,,,,
msg_iteration.17096.user.cozytvarchive.post.10935,1681447027,cozytvarchive,10935,,Boseph Gm! Mwah Part 1 of 2 06/29/2023 • 5 hour 17 minute stream • 31 peak viewers,2023-06-29 16:50:43+00:00,https://t.me/cozytvarchive/10935,,,179,0,0,0,,,,,,,0,,,1,MessageMediaDocument,0,,,,,video/mp4,4.967884672945096e+18,9542.0,boseph-2023-06-29-part-0.mp4,,,,,,,,,,,,,,,
msg_iteration.17097.user.cozytvarchive.post.10934,1681447027,cozytvarchive,10934,,JLP 6/29/23 Thurs. The Jesse Lee Peterson Show | 888-77-JESSE 06/29/2023 • 3 hour 22 minute stream • 38 peak viewers,2023-06-29 16:27:28+00:00,https://t.me/cozytvarchive/10934,,,178,0,0,0,,,,,,,0,,,1,MessageMediaDocument,0,,,,,video/mp4,4.967884672945096e+18,12036.0,jlp-2023-06-29.mp4,,,,,,,,,,,,,,,
msg_iteration.17098.user.cozytvarchive.post.10933,1681447027,cozytvarchive,10933,,Tenryo The TenryOpinion #3: COOMVERSION - The exposing of Islam converts Part 2 of 2,2023-06-29 15:19:17+00:00,https://t.me/cozytvarchive/10933,,,183,0,0,0,,,,,,,0,,,1,MessageMediaDocument,0,,,,,video/mp4,4.967884672945096e+18,10387.0,tenryo-2023-06-29-part-1.mp4,,,,,,,,,,,,,,,
msg_iteration.17099.user.cozytvarchive.post.10932,1681447027,cozytvarchive,10932,,Tenryo The TenryOpinion #3: COOMVERSION - The exposing of Islam converts Part 1 of 2 06/29/2023 • 5 hour 46 minute stream • 43 peak viewers,2023-06-29 15:12:24+00:00,https://t.me/cozytvarchive/10932,,,203,0,0,0,,,,,,,0,,,1,MessageMediaDocument,0,,,,,video/mp4,4.967884672945096e+18,10408.0,tenryo-2023-06-29-part-0.mp4,,,,,,,,,,,,,,,
msg_iteration.17100.user.cozytvarchive.post.10931,1681447027,cozytvarchive,10931,,CrossTalkNews BIBLE STUDY & LIVE HYMNS: Acts 17 & Psalm 14 06/29/2023 • 1 hour 28 minute stream • 23 peak viewers,2023-06-29 13:01:33+00:00,https://t.me/cozytvarchive/10931,,,208,0,0,0,,,,,,,0,,,1,MessageMediaDocument,0,,,,,video/mp4,4.967884672945096e+18,5316.0,crosstalknews-2023-06-29.mp4,,,,,,,,,,,,,,,
msg_iteration.17101.user.cozytvarchive.post.10930,1681447027,cozytvarchive,10930,,"Nick IRAN WAR IMMINENT??? Little Satan Israel SABOTAGES Biden Peace Talks, DEMANDS BLOOD | America First Ep. 1183 06/29/2023 • 2 hour stream • 4,664 peak viewers",2023-06-29 09:10:20+00:00,https://t.me/cozytvarchive/10930,,,215,0,1,0,,,,,,,0,,,1,MessageMediaDocument,0,,,,,video/mp4,4.967884672945096e+18,7211.0,nick-2023-06-29.mp4,,,,,,,,,,,,,,,
msg_iteration.17102.user.cozytvarchive.post.10929,1681447027,cozytvarchive,10929,,PoliticallyProvoked INSANE PEOPLE ONLINE RABBIT HOLE Part 2 of 2,2023-06-29 08:12:26+00:00,https://t.me/cozytvarchive/10929,,,214,0,0,0,,,,,,,0,,,1,MessageMediaDocument,0,,,,,video/mp4,4.965632873131411e+18,10089.0,politicallyprovoked-2023-06-29-part-1.mp4,,,,,,,,,,,,,,,
msg_iteration.17103.user.cozytvarchive.post.10928,1681447027,cozytvarchive,10928,,PoliticallyProvoked INSANE PEOPLE ONLINE RABBIT HOLE Part 1 of 2 06/28/2023 • 5 hour 36 minute stream • 159 peak viewers,2023-06-29 08:04:46+00:00,https://t.me/cozytvarchive/10928,,,215,0,0,0,,,,,,,0,,,1,MessageMediaDocument,0,,,,,video/mp4,4.965632873131411e+18,10109.0,politicallyprovoked-2023-06-29-part-0.mp4,,,,,,,,,,,,,,,
msg_iteration.17104.user.cozytvarchive.post.10927,1681447027,cozytvarchive,10927,,wendell skallastown space 6/28 Part 3 of 3,2023-06-29 07:48:35+00:00,https://t.me/cozytvarchive/10927,,,883,0,5,0,,,,,,,0,,,1,MessageMediaDocument,0,,,,,video/mp4,4.965632873131411e+18,8777.0,wendell-2023-06-29-part-2.mp4,,,,,,,,,,,,,,,
msg_iteration.17105.user.cozytvarchive.post.10926,1681447027,cozytvarchive,10926,,wendell skallastown space 6/28 Part 2 of 3,2023-06-29 07:41:55+00:00,https://t.me/cozytvarchive/10926,,,839,0,5,0,,,,,,,0,,,1,MessageMediaDocument,0,,,,,video/mp4,4.965632873131411e+18,8816.0,wendell-2023-06-29-part-1.mp4,,,,,,,,,,,,,,,
msg_iteration.17106.user.cozytvarchive.post.10925,1681447027,cozytvarchive,10925,,wendell skallastown space 6/28 Part 1 of 3 06/28/2023 • 7 hour 20 minute stream • 251 peak viewers,2023-06-29 07:35:40+00:00,https://t.me/cozytvarchive/10925,,,822,0,5,0,,,,,,,0,,,1,MessageMediaDocument,0,,,,,video/mp4,4.965632873131411e+18,8816.0,wendell-2023-06-29-part-0.mp4,,,,,,,,,,,,,,,
msg_iteration.17107.user.cozytvarchive.post.10924,1681447027,cozytvarchive,10924,,TRSartor VSVV: Designing the Wurzelsuit Part 2 of 2,2023-06-29 07:12:11+00:00,https://t.me/cozytvarchive/10924,,,219,0,1,0,,,,,,,0,,,1,MessageMediaDocument,0,,,,,video/mp4,4.965632873131411e+18,7135.0,trsartor-2023-06-29-part-1.mp4,,,,,,,,,,,,,,,
msg_iteration.17108.user.cozytvarchive.post.10923,1681447027,cozytvarchive,10923,,TRSartor VSVV: Designing the Wurzelsuit Part 1 of 2 06/28/2023 • 3 hour 58 minute stream • 47 peak viewers,2023-06-29 07:05:41+00:00,https://t.me/cozytvarchive/10923,,,221,0,2,0,,,,,,,0,,,1,MessageMediaDocument,0,,,,,video/mp4,4.965632873131411e+18,7158.0,trsartor-2023-06-29-part-0.mp4,,,,,,,,,,,,,,,
msg_iteration.17109.user.cozytvarchive.post.10922,1681447027,cozytvarchive,10922,,PaulTown PTH 261: 🤓 https://discord.gg/U2ngZxKvnn 🤓 WELCOME TO CONTENTMANIA Part 2 of 2,2023-06-29 05:20:25+00:00,https://t.me/cozytvarchive/10922,,,510,0,2,0,,,,,,,0,,,1,MessageMediaDocument,0,,,,,video/mp4,4.965632873131411e+18,11301.0,paultown-2023-06-29-part-1.mp4,,,,,,,,,,,,,,,
msg_iteration.17110.user.cozytvarchive.post.10921,1681447027,cozytvarchive,10921,,PaulTown PTH 261: 🤓 https://discord.gg/U2ngZxKvnn 🤓 WELCOME TO CONTENTMANIA Part 1 of 2 06/28/2023 • 6 hour 17 minute stream • 702 peak viewers,2023-06-29 05:12:39+00:00,https://t.me/cozytvarchive/10921,,,495,0,2,0,,,,,,,0,,,1,MessageMediaDocument,0,,,,,video/mp4,4.965632873131411e+18,11321.0,paultown-2023-06-29-part-0.mp4,,,,,,,,,,,,,,,
msg_iteration.17111.user.cozytvarchive.post.10920,1681447027,cozytvarchive,10920,,LPoriginalG Debating a prostitute about whether or not children should masturbate 06/28/2023 • 1 hour 33 minute stream • 29 peak viewers,2023-06-29 04:12:41+00:00,https://t.me/cozytvarchive/10920,,,222,0,0,0,,,,,,,0,,,1,MessageMediaDocument,0,,,,,video/mp4,4.965632873131411e+18,5619.0,lporiginalg-2023-06-29.mp4,,,,,,,,,,,,,,,
msg_iteration.17112.user.cozytvarchive.post.10919,1681447027,cozytvarchive,10919,,Wurzelroot WURSE WURLD: WRSWRLD: KWEDNESDAY KONTENT: LETS GO THIS IS SOME NEVER BEFORE SEEN UNSKIPPABLE CONTENT CLICK HERE NOW 😨😳 Part 2 of 2,2023-06-29 02:44:41+00:00,https://t.me/cozytvarchive/10919,,,248,0,7,0,,,,,,,0,,,1,MessageMediaDocument,0,,,,,video/mp4,4.965632873131411e+18,8589.0,wurzelroot-2023-06-29-part-1.mp4,,,,,,,,,,,,,,,
msg_iteration.17113.user.cozytvarchive.post.10918,1681447027,cozytvarchive,10918,,Wurzelroot WURSE WURLD: WRSWRLD: KWEDNESDAY KONTENT: LETS GO THIS IS SOME NEVER BEFORE SEEN UNSKIPPABLE CONTENT CLICK HERE NOW 😨😳 Part 1 of 2 06/28/2023 • 4 hour 46 minute stream • 525 peak viewers,2023-06-29 02:38:30+00:00,https://t.me/cozytvarchive/10918,,,242,0,7,0,,,,,,,0,,,1,MessageMediaDocument,0,,,,,video/mp4,4.965632873131411e+18,8608.0,wurzelroot-2023-06-29-part-0.mp4,,,,,,,,,,,,,,,
msg_iteration.17114.user.cozytvarchive.post.10917,1681447027,cozytvarchive,10917,,JoeTheBoomer The Dirty Bastard Live with Joe The Boomer Part 4 of 4,2023-06-29 02:25:21+00:00,https://t.me/cozytvarchive/10917,,,211,0,0,0,,,,,,,0,,,1,MessageMediaDocument,0,,,,,video/mp4,4.965632873131411e+18,9229.0,joetheboomer-2023-06-29-part-3.mp4,,,,,,,,,,,,,,,
msg_iteration.17115.user.cozytvarchive.post.10916,1681447027,cozytvarchive,10916,,JoeTheBoomer The Dirty Bastard Live with Joe The Boomer Part 3 of 4,2023-06-29 02:18:11+00:00,https://t.me/cozytvarchive/10916,,,200,0,0,0,,,,,,,0,,,1,MessageMediaDocument,0,,,,,video/mp4,4.965632873131411e+18,9266.0,joetheboomer-2023-06-29-part-2.mp4,,,,,,,,,,,,,,,
msg_iteration.17116.user.cozytvarchive.post.10915,1681447027,cozytvarchive,10915,,JoeTheBoomer The Dirty Bastard Live with Joe The Boomer Part 2 of 4,2023-06-29 02:11:10+00:00,https://t.me/cozytvarchive/10915,,,202,0,0,0,,,,,,,0,,,1,MessageMediaDocument,0,,,,,video/mp4,4.965632873131411e+18,9266.0,joetheboomer-2023-06-29-part-1.mp4,,,,,,,,,,,,,,,
msg_iteration.17117.user.cozytvarchive.post.10914,1681447027,cozytvarchive,10914,,JoeTheBoomer The Dirty Bastard Live with Joe The Boomer Part 1 of 4 06/28/2023 • 10 hour 17 minute stream • 341 peak viewers,2023-06-29 02:04:17+00:00,https://t.me/cozytvarchive/10914,,,200,0,0,0,,,,,,,0,,,1,MessageMediaDocument,0,,,,,video/mp4,4.965632873131411e+18,9275.0,joetheboomer-2023-06-29-part-0.mp4,,,,,,,,,,,,,,,
msg_iteration.17118.user.cozytvarchive.post.10913,1681447027,cozytvarchive,10913,,"BigTech TOTAL ASHKENAZI VICTORY, GOYIM FELTED: HIT GOAL FOR 23 AND ME Part 2 of 2",2023-06-29 00:05:10+00:00,https://t.me/cozytvarchive/10913,,,324,0,1,0,,,,,,,0,,,1,MessageMediaDocument,0,,,,,video/mp4,4.965632873131411e+18,8827.0,bigtech-2023-06-28_1-part-1.mp4,,,,,,,,,,,,,,,
msg_iteration.17119.user.cozytvarchive.post.10912,1681447027,cozytvarchive,10912,,"BigTech TOTAL ASHKENAZI VICTORY, GOYIM FELTED: HIT GOAL FOR 23 AND ME Part 1 of 2 06/28/2023 • 4 hour 54 minute stream • 529 peak viewers",2023-06-28 23:59:07+00:00,https://t.me/cozytvarchive/10912,,,325,0,2,0,,,,,,,0,,,1,MessageMediaDocument,0,,,,,video/mp4,4.965632873131411e+18,8846.0,bigtech-2023-06-28_1-part-0.mp4,,,,,,,,,,,,,,,
msg_iteration.17120.user.cozytvarchive.post.10911,1681447027,cozytvarchive,10911,,"StewPeters LIVE: Feminine Beauty TRIGGERS Rolling Stone, IRS RAIDS Montana Gun Store, LGBT Pedophile Predators 06/28/2023 • 1 hour 1 minute stream • 9 peak viewers",2023-06-28 23:23:35+00:00,https://t.me/cozytvarchive/10911,,,207,0,0,0,,,,,,,0,,,1,MessageMediaDocument,0,,,,,video/mp4,4.965632873131411e+18,3703.0,stewpeters-2023-06-28.mp4,,,,,,,,,,,,,,,
msg_iteration.17121.user.cozytvarchive.post.10910,1681447027,cozytvarchive,10910,,Stone Joe Pags & Roger Stone On The Woke Left's Plot To Destroy America - The StoneZONE 06/28/2023 • 59 minute stream • 8 peak viewers,2023-06-28 22:09:56+00:00,https://t.me/cozytvarchive/10910,,,207,0,0,0,,,,,,,0,,,1,MessageMediaDocument,0,,,,,video/mp4,4.965632873131411e+18,3582.0,stone-2023-06-28.mp4,,,,,,,,,,,,,,,
msg_iteration.17122.user.cozytvarchive.post.10909,1681447027,cozytvarchive,10909,,PatrickHowley Con Inc. Rears Its Ugly Head To Try To Stop Trump | The Campaign Show 06/28/2023 • 32 minute stream • 18 peak viewers,2023-06-28 21:43:08+00:00,https://t.me/cozytvarchive/10909,,,211,0,0,0,,,,,,,0,,,1,MessageMediaDocument,0,,,,,video/mp4,4.965632873131411e+18,1978.0,patrickhowley-2023-06-28.mp4,,,,,,,,,,,,,,,
